qseqid	tool	Protein names	Function [CC]	Gene Ontology (GO)	EC number	extra
tr|L1P9P4|L1P9P4_9FLAO	UPIMAPI	Outer membrane protein beta-barrel domain-containing protein				sseqid: L1P9P4; pident: 100.0; length: 180; mismatch: 0; gapopen: 0; qstart: 1; qend: 180; sstart: 1; send: 180; evalue: 4.089999999999999e-126; bitscore: 361.0; Entry: L1P9P4; Entry Name: L1P9P4_9FLAO; Annotation: 1.0; Pfam: PF13505;
tr|L1N9G4|L1N9G4_9PORP	UPIMAPI	Uncharacterized protein		cell outer membrane [GO:0009279]; siderophore uptake transmembrane transporter activity [GO:0015344]		sseqid: L1N9G4; pident: 100.0; length: 1036; mismatch: 0; gapopen: 0; qstart: 1; qend: 1036; sstart: 1; send: 1036; evalue: 0.0; bitscore: 2080.0; Entry: L1N9G4; Entry Name: L1N9G4_9PORP; Annotation: 1.0; Pfam: PF13620;
tr|L0MCI7|L0MCI7_9GAMM	UPIMAPI	Phytase-like domain-containing protein				sseqid: L0MCI7; pident: 100.0; length: 451; mismatch: 0; gapopen: 0; qstart: 1; qend: 451; sstart: 1; send: 451; evalue: 0.0; bitscore: 919.0; Entry: L0MCI7; Entry Name: L0MCI7_9GAMM; Annotation: 1.0; Pfam: PF13449;
tr|L0KVN3|L0KVN3_METHD	UPIMAPI	Putative endonuclease related to Holliday junction resolvase		membrane [GO:0016020]; DNA binding [GO:0003677]; endonuclease activity [GO:0004519]; DNA restriction-modification system [GO:0009307]		sseqid: L0KVN3; pident: 100.0; length: 598; mismatch: 0; gapopen: 0; qstart: 1; qend: 598; sstart: 1; send: 598; evalue: 0.0; bitscore: 1171.0; Entry: L0KVN3; Entry Name: L0KVN3_METHD; Annotation: 1.0; Pfam: PF04471;PF00515;PF13414;PF13432;PF13181;
tr|L0KCY7|L0KCY7_HALHC	UPIMAPI	Tripartite ATP-independent periplasmic transporter solute receptor, DctP family		outer membrane-bounded periplasmic space [GO:0030288]; transmembrane transport [GO:0055085]		sseqid: L0KCY7; pident: 100.0; length: 351; mismatch: 0; gapopen: 0; qstart: 1; qend: 351; sstart: 1; send: 351; evalue: 1.6499999999999995e-249; bitscore: 687.0; Entry: L0KCY7; Entry Name: L0KCY7_HALHC; Annotation: 1.0; Protein families: Bacterial solute-binding protein 7 family; Pfam: PF03480;
tr|L0K857|L0K857_HALHC	UPIMAPI	Trypsin-like serine protease with C-terminal PDZ domain		serine-type endopeptidase activity [GO:0004252]; proteolysis [GO:0006508]		sseqid: L0K857; pident: 100.0; length: 366; mismatch: 0; gapopen: 0; qstart: 1; qend: 366; sstart: 1; send: 366; evalue: 8.219999999999996e-253; bitscore: 697.0; Entry: L0K857; Entry Name: L0K857_HALHC; Annotation: 1.0; Pfam: PF00595;PF13365;
tr|L0JZN7|L0JZN7_9EURY	UPIMAPI	Uncharacterized protein				sseqid: L0JZN7; pident: 100.0; length: 107; mismatch: 0; gapopen: 0; qstart: 1; qend: 107; sstart: 1; send: 107; evalue: 7.14e-67; bitscore: 206.0; Entry: L0JZN7; Entry Name: L0JZN7_9EURY; Annotation: 1.0; Pfam: PF19095;
tr|L0ILR7|L0ILR7_THETR	UPIMAPI	Carbon dioxide concentrating mechanism/carboxysome shell protein		bacterial microcompartment [GO:0031469]		sseqid: L0ILR7; pident: 100.0; length: 91; mismatch: 0; gapopen: 0; qstart: 1; qend: 91; sstart: 1; send: 91; evalue: 1.16e-51; bitscore: 166.0; Entry: L0ILR7; Entry Name: L0ILR7_THETR; Annotation: 1.0; Protein families: Bacterial microcompartments protein family, CsoS1 subfamily; Pfam: PF00936;
tr|L0HJY3|L0HJY3_METFS	UPIMAPI	N5-methyltetrahydromethanopterin:coenzyme M methyltransferase subunit H		methyltransferase activity [GO:0008168]; methylation [GO:0032259]; one-carbon metabolic process [GO:0006730]		sseqid: L0HJY3; pident: 100.0; length: 345; mismatch: 0; gapopen: 0; qstart: 1; qend: 345; sstart: 1; send: 345; evalue: 2.879999999999998e-256; bitscore: 704.0; Entry: L0HJY3; Entry Name: L0HJY3_METFS; Annotation: 1.0; Pfam: PF02007;
tr|L0HIQ8|L0HIQ8_METFS	UPIMAPI	5,10-methylenetetrahydromethanopterin reductase (EC 1.5.98.2) (Coenzyme F420-dependent N(5),N(10)-methylenetetrahydromethanopterin reductase) (Methylene-H(4)MPT reductase)	FUNCTION: Catalyzes the reversible reduction of methylene-H(4)MPT to methyl-H(4)MPT. {ECO:0000256|HAMAP-Rule:MF_01091}.	cytoplasm [GO:0005737]; coenzyme F420-dependent N5,N10-methenyltetrahydromethanopterin reductase activity [GO:0018537]; oxidoreductase activity, acting on paired donors, with incorporation or reduction of molecular oxygen [GO:0016705]; methanogenesis, from carbon dioxide [GO:0019386]; one-carbon metabolic process [GO:0006730]	1.5.98.2	sseqid: L0HIQ8; pident: 100.0; length: 328; mismatch: 0; gapopen: 0; qstart: 1; qend: 328; sstart: 1; send: 328; evalue: 7.989999999999997e-234; bitscore: 646.0; Entry: L0HIQ8; Entry Name: L0HIQ8_METFS; Annotation: 2.0; Protein families: Mer family; Pfam: PF00296;
tr|L0HG11|L0HG11_METFS	UPIMAPI	DUF3821 domain-containing protein		extracellular region [GO:0005576]; membrane [GO:0016020]; S-layer [GO:0030115]		sseqid: L0HG11; pident: 100.0; length: 939; mismatch: 0; gapopen: 0; qstart: 1; qend: 939; sstart: 1; send: 939; evalue: 0.0; bitscore: 1766.0; Entry: L0HG11; Entry Name: L0HG11_METFS; Annotation: 1.0; Pfam: PF12863;PF18204;
tr|L0HFW2|L0HFW2_METFS	UPIMAPI	Small ribosomal subunit protein uS8	FUNCTION: One of the primary rRNA binding proteins, it binds directly to 16S rRNA central domain where it helps coordinate assembly of the platform of the 30S subunit. {ECO:0000256|HAMAP-Rule:MF_01302}.	ribonucleoprotein complex [GO:1990904]; ribosome [GO:0005840]; rRNA binding [GO:0019843]; structural constituent of ribosome [GO:0003735]; translation [GO:0006412]		sseqid: L0HFW2; pident: 100.0; length: 130; mismatch: 0; gapopen: 0; qstart: 1; qend: 130; sstart: 1; send: 130; evalue: 6.25e-90; bitscore: 266.0; Entry: L0HFW2; Entry Name: L0HFW2_METFS; Annotation: 2.0; Protein families: Universal ribosomal protein uS8 family; Pfam: PF00410;
tr|L0HFT2|L0HFT2_METFS	UPIMAPI	Methyl-coenzyme M reductase subunit beta (EC 2.8.4.1) (Coenzyme-B sulfoethylthiotransferase beta)		coenzyme-B sulfoethylthiotransferase activity [GO:0050524]; methanogenesis [GO:0015948]	2.8.4.1	sseqid: L0HFT2; pident: 100.0; length: 437; mismatch: 0; gapopen: 0; qstart: 1; qend: 437; sstart: 1; send: 437; evalue: 4.06e-314; bitscore: 858.0; Entry: L0HFT2; Entry Name: L0HFT2_METFS; Annotation: 2.0; Protein families: Methyl-coenzyme M reductase beta subunit family; Pfam: PF02241;PF02783;
tr|L0HES5|L0HES5_METFS	UPIMAPI	Ferritin-like protein		cytosol [GO:0005829]; ferric iron binding [GO:0008199]; ferrous iron binding [GO:0008198]; ferroxidase activity [GO:0004322]; intracellular iron ion homeostasis [GO:0006879]; iron ion transport [GO:0006826]		sseqid: L0HES5; pident: 100.0; length: 162; mismatch: 0; gapopen: 0; qstart: 1; qend: 162; sstart: 1; send: 162; evalue: 1.5299999999999996e-110; bitscore: 320.0; Entry: L0HES5; Entry Name: L0HES5_METFS; Annotation: 1.0; Pfam: PF00210;
tr|L0HEI3|L0HEI3_METFS	UPIMAPI	formate dehydrogenase (coenzyme F420) (EC 1.17.98.3)		iron-sulfur cluster binding [GO:0051536]; oxidoreductase activity, acting on CH or CH2 groups, with an iron-sulfur protein as acceptor [GO:0052592]	1.17.98.3	sseqid: L0HEI3; pident: 100.0; length: 383; mismatch: 0; gapopen: 0; qstart: 1; qend: 383; sstart: 1; send: 383; evalue: 1.9799999999999993e-289; bitscore: 791.0; Entry: L0HEI3; Entry Name: L0HEI3_METFS; Annotation: 1.0; Pfam: PF13183;PF04432;PF04422;
tr|L0HDN6|L0HDN6_METFS	UPIMAPI	Molecular chaperone (Small heat shock protein)				sseqid: L0HDN6; pident: 100.0; length: 157; mismatch: 0; gapopen: 0; qstart: 1; qend: 157; sstart: 1; send: 157; evalue: 6.519999999999999e-105; bitscore: 306.0; Entry: L0HDN6; Entry Name: L0HDN6_METFS; Annotation: 1.0; Protein families: Small heat shock protein (HSP20) family; Pfam: PF00011;
tr|L0HCB0|L0HCB0_METFS	UPIMAPI	Phosphoenolpyruvate synthase (PEP synthase) (EC 2.7.9.2) (Pyruvate, water dikinase)	FUNCTION: Catalyzes the phosphorylation of pyruvate to phosphoenolpyruvate. {ECO:0000256|ARBA:ARBA00002988, ECO:0000256|PIRNR:PIRNR000854}.	ATP binding [GO:0005524]; metal ion binding [GO:0046872]; pyruvate, water dikinase activity [GO:0008986]; gluconeogenesis [GO:0006094]; pyruvate metabolic process [GO:0006090]	2.7.9.2	sseqid: L0HCB0; pident: 100.0; length: 760; mismatch: 0; gapopen: 0; qstart: 1; qend: 760; sstart: 1; send: 760; evalue: 0.0; bitscore: 1475.0; Entry: L0HCB0; Entry Name: L0HCB0_METFS; Annotation: 2.0; Protein families: PEP-utilizing enzyme family; Pfam: PF00391;PF02896;PF01326;
tr|L0HAF8|L0HAF8_METFS	UPIMAPI	Formate dehydrogenase, alpha subunit, archaeal-type		membrane [GO:0016020]; 4 iron, 4 sulfur cluster binding [GO:0051539]; formate dehydrogenase (NAD+) activity [GO:0008863]; metal ion binding [GO:0046872]; molybdopterin cofactor binding [GO:0043546]; NADH dehydrogenase activity [GO:0003954]; formate metabolic process [GO:0015942]; respiratory electron transport chain [GO:0022904]		sseqid: L0HAF8; pident: 100.0; length: 689; mismatch: 0; gapopen: 0; qstart: 1; qend: 689; sstart: 1; send: 689; evalue: 0.0; bitscore: 1427.0; Entry: L0HAF8; Entry Name: L0HAF8_METFS; Annotation: 2.0; Protein families: Prokaryotic molybdopterin-containing oxidoreductase family; Pfam: PF04879;PF00384;PF01568;
tr|L0FWI5|L0FWI5_ECHVK	UPIMAPI	Outer membrane receptor for ferrienterochelin and colicins		cell outer membrane [GO:0009279]; siderophore uptake transmembrane transporter activity [GO:0015344]		sseqid: L0FWI5; pident: 100.0; length: 1050; mismatch: 0; gapopen: 0; qstart: 1; qend: 1050; sstart: 1; send: 1050; evalue: 0.0; bitscore: 2040.0; Entry: L0FWI5; Entry Name: L0FWI5_ECHVK; Annotation: 1.0; Pfam: PF13620;PF00593;
tr|L0F5D2|L0F5D2_DESDL	UPIMAPI	Benzoyl-CoA reductase/2-hydroxyglutaryl-CoA dehydratase subunit, BcrC/BadD/HgdB (EC 1.3.7.8)		benzoyl-CoA reductase activity [GO:0018522]; hydro-lyase activity [GO:0016836]; iron-sulfur cluster binding [GO:0051536]; metal ion binding [GO:0046872]	1.3.7.8	sseqid: L0F5D2; pident: 100.0; length: 381; mismatch: 0; gapopen: 0; qstart: 1; qend: 381; sstart: 1; send: 381; evalue: 4.2899999999999975e-283; bitscore: 775.0; Entry: L0F5D2; Entry Name: L0F5D2_DESDL; Annotation: 1.0; Protein families: FldB/FldC dehydratase alpha/beta subunit family; Pfam: PF06050;
tr|L0F326|L0F326_DESDL	UPIMAPI	Benzoyl-CoA reductase/2-hydroxyglutaryl-CoA dehydratase subunit, BcrC/BadD/HgdB		hydro-lyase activity [GO:0016836]		sseqid: L0F326; pident: 100.0; length: 422; mismatch: 0; gapopen: 0; qstart: 1; qend: 422; sstart: 1; send: 422; evalue: 3.58e-314; bitscore: 857.0; Entry: L0F326; Entry Name: L0F326_DESDL; Annotation: 1.0; Protein families: FldB/FldC dehydratase alpha/beta subunit family; Pfam: PF06050;
tr|L0DDH1|L0DDH1_SINAD	UPIMAPI	Type VI secretion protein, EvpB/VC_A0108 family				sseqid: L0DDH1; pident: 100.0; length: 497; mismatch: 0; gapopen: 0; qstart: 1; qend: 497; sstart: 1; send: 497; evalue: 0.0; bitscore: 985.0; Entry: L0DDH1; Entry Name: L0DDH1_SINAD; Annotation: 1.0; Pfam: PF05943;PF18945;
tr|K9Z2F0|K9Z2F0_CYAAP	UPIMAPI	Extracellular solute-binding protein, family 7		tripartite ATP-independent periplasmic transporter complex [GO:0031317]; metal ion binding [GO:0046872]; organic acid binding [GO:0043177]; organic acid transport [GO:0015849]; transmembrane transport [GO:0055085]		sseqid: K9Z2F0; pident: 100.0; length: 366; mismatch: 0; gapopen: 0; qstart: 1; qend: 366; sstart: 1; send: 366; evalue: 2.5299999999999983e-272; bitscore: 746.0; Entry: K9Z2F0; Entry Name: K9Z2F0_CYAAP; Annotation: 1.0; Pfam: PF03480;
tr|K9S4F8|K9S4F8_9CYAN	UPIMAPI	Conserved repeat domain protein				sseqid: K9S4F8; pident: 100.0; length: 320; mismatch: 0; gapopen: 0; qstart: 1; qend: 320; sstart: 1; send: 320; evalue: 2.099999999999999e-225; bitscore: 624.0; Entry: K9S4F8; Entry Name: K9S4F8_9CYAN; Annotation: 1.0; Pfam: PF01345;
tr|K9QIK0|K9QIK0_9NOSO	UPIMAPI	adenosine deaminase (EC 3.5.4.4)		cytosol [GO:0005829]; adenosine deaminase activity [GO:0004000]; adenosine catabolic process [GO:0006154]; hypoxanthine salvage [GO:0043103]; inosine biosynthetic process [GO:0046103]	3.5.4.4	sseqid: K9QIK0; pident: 100.0; length: 523; mismatch: 0; gapopen: 0; qstart: 1; qend: 523; sstart: 1; send: 523; evalue: 0.0; bitscore: 1036.0; Entry: K9QIK0; Entry Name: K9QIK0_9NOSO; Annotation: 2.0; Protein families: Metallo-dependent hydrolases superfamily, Adenosine and AMP deaminases family; Pfam: PF00962;
tr|K9IZS4|K9IZS4_DESRO	UPIMAPI	Putative conserved plasma membrane protein		apical plasma membrane [GO:0016324]; cell surface [GO:0009986]; cilium [GO:0005929]; microvillus membrane [GO:0031528]; prominosome [GO:0071914]; cholesterol binding [GO:0015485]; camera-type eye photoreceptor cell differentiation [GO:0060219]; photoreceptor cell maintenance [GO:0045494]		sseqid: K9IZS4; pident: 100.0; length: 847; mismatch: 0; gapopen: 0; qstart: 1; qend: 847; sstart: 1; send: 847; evalue: 0.0; bitscore: 1678.0; Entry: K9IZS4; Entry Name: K9IZS4_DESRO; Annotation: 2.0; Protein families: Prominin family; Pfam: PF05478;
tr|K8PA47|K8PA47_9BRAD	UPIMAPI	Phosphonate C-P lyase system protein PhnK	FUNCTION: Involved in beta-(1-->2)glucan export. Transmembrane domains (TMD) form a pore in the inner membrane and the ATP-binding domain (NBD) is responsible for energy generation. {ECO:0000256|ARBA:ARBA00024722}.	ATP binding [GO:0005524]; ATP hydrolysis activity [GO:0016887]; lyase activity [GO:0016829]; organic phosphonate catabolic process [GO:0019700]		sseqid: K8PA47; pident: 100.0; length: 260; mismatch: 0; gapopen: 0; qstart: 1; qend: 260; sstart: 1; send: 260; evalue: 1.5999999999999995e-183; bitscore: 513.0; Entry: K8PA47; Entry Name: K8PA47_9BRAD; Annotation: 1.0; Protein families: ABC transporter superfamily; Pfam: PF00005;
tr|K8EA32|K8EA32_9FIRM	UPIMAPI	Copper amine oxidase domain protein				sseqid: K8EA32; pident: 100.0; length: 725; mismatch: 0; gapopen: 0; qstart: 1; qend: 725; sstart: 1; send: 725; evalue: 0.0; bitscore: 1365.0; Entry: K8EA32; Entry Name: K8EA32_9FIRM; Annotation: 1.0; Pfam: PF07833;
tr|K7ZPQ2|K7ZPQ2_9BACT	UPIMAPI	[FeFe]-hydrogenase				sseqid: K7ZPQ2; pident: 100.0; length: 193; mismatch: 0; gapopen: 0; qstart: 1; qend: 193; sstart: 1; send: 193; evalue: 5.279999999999999e-133; bitscore: 380.0; Entry: K7ZPQ2; Entry Name: K7ZPQ2_9BACT; Annotation: 1.0; Pfam: PF02906;
tr|K7ATD6|K7ATD6_9ALTE	UPIMAPI	Uncharacterized protein				sseqid: K7ATD6; pident: 100.0; length: 137; mismatch: 0; gapopen: 0; qstart: 1; qend: 137; sstart: 1; send: 137; evalue: 3.3999999999999986e-95; bitscore: 280.0; Entry: K7ATD6; Entry Name: K7ATD6_9ALTE; Annotation: 1.0
tr|K6Y347|K6Y347_9ALTE	UPIMAPI	AraC family transcriptional regulator		DNA-binding transcription factor activity [GO:0003700]; sequence-specific DNA binding [GO:0043565]		sseqid: K6Y347; pident: 100.0; length: 299; mismatch: 0; gapopen: 0; qstart: 1; qend: 299; sstart: 1; send: 299; evalue: 4.519999999999998e-214; bitscore: 593.0; Entry: K6Y347; Entry Name: K6Y347_9ALTE; Annotation: 1.0; Pfam: PF12852;PF12833;
tr|K6U8X0|K6U8X0_9EURY	UPIMAPI	CoB--CoM heterodisulfide reductase iron-sulfur subunit A (EC 1.8.-.-)	FUNCTION: Part of a complex that catalyzes the reversible reduction of CoM-S-S-CoB to the thiol-coenzymes H-S-CoM (coenzyme M) and H-S-CoB (coenzyme B). {ECO:0000256|RuleBase:RU366072}.	4 iron, 4 sulfur cluster binding [GO:0051539]; metal ion binding [GO:0046872]; oxidoreductase activity [GO:0016491]	1.8.-.-	sseqid: K6U8X0; pident: 100.0; length: 302; mismatch: 0; gapopen: 0; qstart: 1; qend: 302; sstart: 1; send: 302; evalue: 5.539999999999998e-221; bitscore: 611.0; Entry: K6U8X0; Entry Name: K6U8X0_9EURY; Annotation: 2.0; Protein families: HdrA family; Pfam: PF12831;PF00037;
tr|K6U6K0|K6U6K0_9EURY	UPIMAPI	Dinitrogenase iron-molybdenum cofactor biosynthesis domain-containing protein				sseqid: K6U6K0; pident: 100.0; length: 128; mismatch: 0; gapopen: 0; qstart: 1; qend: 128; sstart: 1; send: 128; evalue: 1.8799999999999998e-81; bitscore: 244.0; Entry: K6U6K0; Entry Name: K6U6K0_9EURY; Annotation: 1.0; Pfam: PF02579;
tr|K6U3N2|K6U3N2_9EURY	UPIMAPI	Histones H3 and H4		chromosome [GO:0005694]; cytoplasm [GO:0005737]; protein heterodimerization activity [GO:0046982]		sseqid: K6U3N2; pident: 100.0; length: 96; mismatch: 0; gapopen: 0; qstart: 1; qend: 96; sstart: 1; send: 96; evalue: 2.9699999999999996e-54; bitscore: 173.0; Entry: K6U3N2; Entry Name: K6U3N2_9EURY; Annotation: 1.0; Protein families: Archaeal histone HMF family; Pfam: PF00808;
tr|K6U1N4|K6U1N4_9EURY	UPIMAPI	Archaeal/vacuolar-type H+-ATPase subunit A		ATP binding [GO:0005524]; proton-transporting ATPase activity, rotational mechanism [GO:0046961]; ATP metabolic process [GO:0046034]		sseqid: K6U1N4; pident: 100.0; length: 179; mismatch: 0; gapopen: 0; qstart: 1; qend: 179; sstart: 1; send: 179; evalue: 4.969999999999999e-122; bitscore: 351.0; Entry: K6U1N4; Entry Name: K6U1N4_9EURY; Annotation: 1.0; Protein families: ATPase alpha/beta chains family; Pfam: PF22919;
tr|K6U0X0|K6U0X0_9EURY	UPIMAPI	Hydroxymethylglutaryl-CoA synthase (HMG-CoA synthase) (HMGCS) (EC 2.3.3.10)	FUNCTION: Catalyzes the condensation of acetyl-CoA with acetoacetyl-CoA to form 3-hydroxy-3-methylglutaryl-CoA (HMG-CoA). Functions in the mevalonate (MVA) pathway leading to isopentenyl diphosphate (IPP), a key precursor for the biosynthesis of isoprenoid compounds that are building blocks of archaeal membrane lipids. {ECO:0000256|HAMAP-Rule:MF_01409}.	acetyl-CoA C-acetyltransferase activity [GO:0003985]; hydroxymethylglutaryl-CoA synthase activity [GO:0004421]; farnesyl diphosphate biosynthetic process, mevalonate pathway [GO:0010142]; isopentenyl diphosphate biosynthetic process, mevalonate pathway [GO:0019287]	2.3.3.10	sseqid: K6U0X0; pident: 100.0; length: 351; mismatch: 0; gapopen: 0; qstart: 1; qend: 351; sstart: 1; send: 351; evalue: 1.6499999999999995e-249; bitscore: 687.0; Entry: K6U0X0; Entry Name: K6U0X0_9EURY; Annotation: 3.0; Protein families: Thiolase-like superfamily, Archaeal HMG-CoA synthase family; Pfam: PF08541;PF01154;
tr|K6U0D5|K6U0D5_9EURY	UPIMAPI	Methyl-coenzyme M reductase subunit gamma (EC 2.8.4.1)		coenzyme-B sulfoethylthiotransferase activity [GO:0050524]; methanogenesis [GO:0015948]	2.8.4.1	sseqid: K6U0D5; pident: 100.0; length: 249; mismatch: 0; gapopen: 0; qstart: 1; qend: 249; sstart: 1; send: 249; evalue: 4.439999999999999e-180; bitscore: 503.0; Entry: K6U0D5; Entry Name: K6U0D5_9EURY; Annotation: 2.0; Protein families: Methyl-coenzyme M reductase gamma subunit family; Pfam: PF02240;
tr|K6U020|K6U020_9EURY	UPIMAPI	Small ribosomal subunit protein uS8	FUNCTION: One of the primary rRNA binding proteins, it binds directly to 16S rRNA central domain where it helps coordinate assembly of the platform of the 30S subunit. {ECO:0000256|HAMAP-Rule:MF_01302}.	ribonucleoprotein complex [GO:1990904]; ribosome [GO:0005840]; rRNA binding [GO:0019843]; structural constituent of ribosome [GO:0003735]; translation [GO:0006412]		sseqid: K6U020; pident: 100.0; length: 130; mismatch: 0; gapopen: 0; qstart: 1; qend: 130; sstart: 1; send: 130; evalue: 1.7899999999999996e-89; bitscore: 265.0; Entry: K6U020; Entry Name: K6U020_9EURY; Annotation: 2.0; Protein families: Universal ribosomal protein uS8 family; Pfam: PF00410;
tr|K6TY70|K6TY70_9EURY	UPIMAPI	PDK repeat-containing protein		membrane [GO:0016020]		sseqid: K6TY70; pident: 100.0; length: 2344; mismatch: 0; gapopen: 0; qstart: 1; qend: 2344; sstart: 1; send: 2344; evalue: 0.0; bitscore: 4360.0; Entry: K6TY70; Entry Name: K6TY70_9EURY; Annotation: 1.0; Pfam: PF07705;PF13290;PF01345;PF11824;PF13517;PF18911;
tr|K6TT41|K6TT41_9EURY	UPIMAPI	AIM24 family protein				sseqid: K6TT41; pident: 100.0; length: 271; mismatch: 0; gapopen: 0; qstart: 1; qend: 271; sstart: 1; send: 271; evalue: 8.24e-187; bitscore: 522.0; Entry: K6TT41; Entry Name: K6TT41_9EURY; Annotation: 1.0; Pfam: PF01987;
tr|K6TPF5|K6TPF5_9EURY	UPIMAPI	Coenzyme F420-reducing hydrogenase, alpha subunit		ferredoxin hydrogenase activity [GO:0008901]; nickel cation binding [GO:0016151]		sseqid: K6TPF5; pident: 100.0; length: 472; mismatch: 0; gapopen: 0; qstart: 1; qend: 472; sstart: 1; send: 472; evalue: 0.0; bitscore: 954.0; Entry: K6TPF5; Entry Name: K6TPF5_9EURY; Annotation: 1.0; Protein families: [NiFe]/[NiFeSe] hydrogenase large subunit family; Pfam: PF00374;
tr|K6TLX4|K6TLX4_9EURY	UPIMAPI	CoB--CoM heterodisulfide reductase subunit B	FUNCTION: Part of a complex that catalyzes the reversible reduction of CoM-S-S-CoB to the thiol-coenzymes H-S-CoM (coenzyme M) and H-S-CoB (coenzyme B). {ECO:0000256|ARBA:ARBA00003406}.	CoB--CoM heterodisulfide reductase activity [GO:0051912]; methanogenesis [GO:0015948]		sseqid: K6TLX4; pident: 100.0; length: 298; mismatch: 0; gapopen: 0; qstart: 1; qend: 298; sstart: 1; send: 298; evalue: 7.009999999999996e-222; bitscore: 613.0; Entry: K6TLX4; Entry Name: K6TLX4_9EURY; Annotation: 1.0; Protein families: HdrB family; Pfam: PF02754;
tr|K6TIY8|K6TIY8_9EURY	UPIMAPI	Coenzyme F420 hydrogenase subunit beta (EC 1.12.98.1)		coenzyme F420 hydrogenase activity [GO:0050454]; flavin adenine dinucleotide binding [GO:0050660]; iron-sulfur cluster binding [GO:0051536]; nickel cation binding [GO:0016151]; oxidoreductase activity, acting on CH or CH2 groups, with an iron-sulfur protein as acceptor [GO:0052592]	1.12.98.1	sseqid: K6TIY8; pident: 100.0; length: 294; mismatch: 0; gapopen: 0; qstart: 1; qend: 294; sstart: 1; send: 294; evalue: 3.4299999999999983e-211; bitscore: 586.0; Entry: K6TIY8; Entry Name: K6TIY8_9EURY; Annotation: 2.0; Protein families: FrhB family; Pfam: PF04432;PF04422;
tr|K6T7B3|K6T7B3_9EURY	UPIMAPI	Transcriptional regulator GfcR		DNA binding [GO:0003677]; orotate phosphoribosyltransferase activity [GO:0004588]; pyrimidine nucleobase biosynthetic process [GO:0019856]; regulation of gene expression [GO:0010468]; UMP biosynthetic process [GO:0006222]		sseqid: K6T7B3; pident: 100.0; length: 199; mismatch: 0; gapopen: 0; qstart: 1; qend: 199; sstart: 1; send: 199; evalue: 2.0499999999999993e-133; bitscore: 381.0; Entry: K6T7B3; Entry Name: K6T7B3_9EURY; Annotation: 2.0; Protein families: Purine/pyrimidine phosphoribosyltransferase family, GfcR subfamily; Pfam: PF00156;
tr|K6GMR5|K6GMR5_9BACT	UPIMAPI	Outer membrane protein/peptidoglycan-associated (Lipo)protein		cell outer membrane [GO:0009279]		sseqid: K6GMR5; pident: 100.0; length: 345; mismatch: 0; gapopen: 0; qstart: 1; qend: 345; sstart: 1; send: 345; evalue: 4.039999999999997e-247; bitscore: 681.0; Entry: K6GMR5; Entry Name: K6GMR5_9BACT; Annotation: 1.0; Pfam: PF00691;
tr|K6C025|K6C025_SCHAZ	UPIMAPI	Propanediol utilization protein PduB		bacterial microcompartment [GO:0031469]; structural molecule activity [GO:0005198]		sseqid: K6C025; pident: 100.0; length: 259; mismatch: 0; gapopen: 0; qstart: 1; qend: 259; sstart: 1; send: 259; evalue: 3.449999999999999e-173; bitscore: 487.0; Entry: K6C025; Entry Name: K6C025_SCHAZ; Annotation: 1.0; Pfam: PF00936;
tr|K6ATV6|K6ATV6_9BACT	UPIMAPI	SusC/RagA family TonB-linked outer membrane protein		cell outer membrane [GO:0009279]; siderophore uptake transmembrane transporter activity [GO:0015344]		sseqid: K6ATV6; pident: 100.0; length: 1057; mismatch: 0; gapopen: 0; qstart: 1; qend: 1057; sstart: 1; send: 1057; evalue: 0.0; bitscore: 2108.0; Entry: K6ATV6; Entry Name: K6ATV6_9BACT; Annotation: 1.0; Protein families: TonB-dependent receptor family; Pfam: PF13715;PF07715;PF00593;
tr|K6AP91|K6AP91_9BACT	UPIMAPI	Tetratricopeptide repeat protein				sseqid: K6AP91; pident: 100.0; length: 563; mismatch: 0; gapopen: 0; qstart: 1; qend: 563; sstart: 1; send: 563; evalue: 0.0; bitscore: 1002.0; Entry: K6AP91; Entry Name: K6AP91_9BACT; Annotation: 1.0; Pfam: PF13181;
tr|K6A6P6|K6A6P6_9BACT	UPIMAPI	DUF6383 domain-containing protein				sseqid: K6A6P6; pident: 100.0; length: 1366; mismatch: 0; gapopen: 0; qstart: 1; qend: 1366; sstart: 1; send: 1366; evalue: 0.0; bitscore: 2710.0; Entry: K6A6P6; Entry Name: K6A6P6_9BACT; Annotation: 1.0; Pfam: PF19910;
tr|K5ZHM4|K5ZHM4_9BACT	UPIMAPI	DUF6383 domain-containing protein				sseqid: K5ZHM4; pident: 100.0; length: 1520; mismatch: 0; gapopen: 0; qstart: 1; qend: 1520; sstart: 1; send: 1520; evalue: 0.0; bitscore: 3035.0; Entry: K5ZHM4; Entry Name: K5ZHM4_9BACT; Annotation: 1.0; Pfam: PF19910;
tr|K5CJG4|K5CJG4_9BACE	UPIMAPI	SusC/RagA family TonB-linked outer membrane protein		cell outer membrane [GO:0009279]; siderophore uptake transmembrane transporter activity [GO:0015344]		sseqid: K5CJG4; pident: 100.0; length: 1078; mismatch: 0; gapopen: 0; qstart: 1; qend: 1078; sstart: 1; send: 1078; evalue: 0.0; bitscore: 2187.0; Entry: K5CJG4; Entry Name: K5CJG4_9BACE; Annotation: 1.0; Protein families: TonB-dependent receptor family; Pfam: PF13715;PF07715;
tr|K5C9G4|K5C9G4_9BACE	UPIMAPI	Alpha-1,2-mannosidase		cytosol [GO:0005829]; carbohydrate binding [GO:0030246]; peptide-N4-(N-acetyl-beta-glucosaminyl)asparagine amidase activity [GO:0000224]; carbohydrate metabolic process [GO:0005975]; glycoprotein catabolic process [GO:0006516]		sseqid: K5C9G4; pident: 100.0; length: 759; mismatch: 0; gapopen: 0; qstart: 1; qend: 759; sstart: 1; send: 759; evalue: 0.0; bitscore: 1579.0; Entry: K5C9G4; Entry Name: K5C9G4_9BACE; Annotation: 2.0; Pfam: PF07971;PF17678;
tr|K4KZ81|K4KZ81_SIMAS	UPIMAPI	Putative oar protein		cell outer membrane [GO:0009279]; carbohydrate binding [GO:0030246]; siderophore uptake transmembrane transporter activity [GO:0015344]		sseqid: K4KZ81; pident: 100.0; length: 991; mismatch: 0; gapopen: 0; qstart: 1; qend: 991; sstart: 1; send: 991; evalue: 0.0; bitscore: 1985.0; Entry: K4KZ81; Entry Name: K4KZ81_SIMAS; Annotation: 1.0; Protein families: TonB-dependent receptor family; Pfam: PF13620;PF00593;
tr|K3ZHE6|K3ZHE6_SETIT	UPIMAPI	NB-ARC domain-containing protein		ADP binding [GO:0043531]; defense response [GO:0006952]; response to other organism [GO:0051707]		sseqid: A0A368S3Z0; pident: 100.0; length: 794; mismatch: 0; gapopen: 0; qstart: 1; qend: 794; sstart: 333; send: 1126; evalue: 0.0; bitscore: 1525.0; Entry: A0A368S3Z0; Entry Name: A0A368S3Z0_SETIT; Annotation: 2.0; Protein families: Disease resistance NB-LRR family; Pfam: PF23598;PF00931;PF18052;PF23559;
