qseqid	tool	Protein names	Function [CC]	Gene Ontology (GO)	EC number	extra
tr|D5ECX8|D5ECX8_AMICL	UPIMAPI	UspA domain protein				sseqid: D5ECX8; pident: 100.0; length: 152; mismatch: 0; gapopen: 0; qstart: 1; qend: 152; sstart: 1; send: 152; evalue: 5.229999999999999e-104; bitscore: 303.0; Entry: D5ECX8; Entry Name: D5ECX8_AMICL; Annotation: 1.0; Protein families: Universal stress protein A family; Pfam: PF00582;
tr|D5ECV7|D5ECV7_AMICL	UPIMAPI	Basic membrane lipoprotein		plasma membrane [GO:0005886]		sseqid: D5ECV7; pident: 100.0; length: 360; mismatch: 0; gapopen: 0; qstart: 1; qend: 360; sstart: 1; send: 360; evalue: 6.919999999999997e-267; bitscore: 732.0; Entry: D5ECV7; Entry Name: D5ECV7_AMICL; Annotation: 1.0; Pfam: PF02608;
tr|D5ECU0|D5ECU0_AMICL	UPIMAPI	Extracellular solute-binding protein family 3		cell envelope [GO:0030313]; membrane [GO:0016020]; ligand-gated monoatomic ion channel activity [GO:0015276]		sseqid: D5ECU0; pident: 100.0; length: 250; mismatch: 0; gapopen: 0; qstart: 1; qend: 250; sstart: 1; send: 250; evalue: 3.899999999999999e-170; bitscore: 478.0; Entry: D5ECU0; Entry Name: D5ECU0_AMICL; Annotation: 1.0; Protein families: Bacterial solute-binding protein 3 family; Pfam: PF00497;
tr|D5ECQ5|D5ECQ5_AMICL	UPIMAPI	Linocin_M18 bacteriocin protein		encapsulin nanocompartment [GO:0140737]		sseqid: D5ECQ5; pident: 100.0; length: 268; mismatch: 0; gapopen: 0; qstart: 1; qend: 268; sstart: 1; send: 268; evalue: 2.1199999999999998e-192; bitscore: 536.0; Entry: D5ECQ5; Entry Name: D5ECQ5_AMICL; Annotation: 1.0; Protein families: Encapsulin family, Family 1 subfamily; Pfam: PF04454;
tr|D5ECM0|D5ECM0_AMICL	UPIMAPI	Extracellular ligand-binding receptor		amino acid transport [GO:0006865]		sseqid: D5ECM0; pident: 100.0; length: 393; mismatch: 0; gapopen: 0; qstart: 1; qend: 393; sstart: 1; send: 393; evalue: 2.5199999999999986e-288; bitscore: 789.0; Entry: D5ECM0; Entry Name: D5ECM0_AMICL; Annotation: 1.0; Protein families: Leucine-binding protein family; Pfam: PF13458;
tr|D5E904|D5E904_METMS	UPIMAPI	PGF-pre-PGF domain-containing protein		membrane [GO:0016020]		sseqid: D5E904; pident: 100.0; length: 427; mismatch: 0; gapopen: 0; qstart: 1; qend: 427; sstart: 1; send: 427; evalue: 2.019999999999999e-277; bitscore: 764.0; Entry: D5E904; Entry Name: D5E904_METMS; Annotation: 1.0
tr|D5C1R8|D5C1R8_NITHN	UPIMAPI	Serine protease				sseqid: D5C1R8; pident: 100.0; length: 346; mismatch: 0; gapopen: 0; qstart: 1; qend: 346; sstart: 1; send: 346; evalue: 1.8499999999999993e-248; bitscore: 684.0; Entry: D5C1R8; Entry Name: D5C1R8_NITHN; Annotation: 1.0
tr|D5BEM4|D5BEM4_ZUNPS	UPIMAPI	Outer membrane protein Omp121		cell outer membrane [GO:0009279]		sseqid: D5BEM4; pident: 100.0; length: 1032; mismatch: 0; gapopen: 0; qstart: 1; qend: 1032; sstart: 1; send: 1032; evalue: 0.0; bitscore: 2051.0; Entry: D5BEM4; Entry Name: D5BEM4_ZUNPS; Annotation: 1.0; Protein families: TonB-dependent receptor family; Pfam: PF13715;PF07715;PF00593;
tr|D4VGR2|D4VGR2_9BACE	UPIMAPI	Polysaccharide pyruvyl transferase domain-containing protein				sseqid: D0TP61; pident: 100.0; length: 378; mismatch: 0; gapopen: 0; qstart: 1; qend: 378; sstart: 1; send: 378; evalue: 1.0299999999999995e-268; bitscore: 738.0; Entry: D0TP61; Entry Name: D0TP61_9BACE; Annotation: 1.0; Pfam: PF04230;
tr|D3Y4Q4|D3Y4Q4_BRAEL	UPIMAPI	glutamine synthetase (EC 6.3.1.2) (Glutamine synthetase II)	FUNCTION: Catalyzes the ATP-dependent biosynthesis of glutamine from glutamate and ammonia. {ECO:0000256|ARBA:ARBA00003117}.	cytoplasm [GO:0005737]; ATP binding [GO:0005524]; glutamine synthetase activity [GO:0004356]; glutamine biosynthetic process [GO:0006542]; nitrogen fixation [GO:0009399]	6.3.1.2	sseqid: D3Y4Q4; pident: 100.0; length: 206; mismatch: 0; gapopen: 0; qstart: 1; qend: 206; sstart: 1; send: 206; evalue: 2.8199999999999988e-157; bitscore: 442.0; Entry: D3Y4Q4; Entry Name: D3Y4Q4_BRAEL; Annotation: 2.0; Protein families: Glutamine synthetase family; Pfam: PF00120;PF03951;
tr|D3S0E7|D3S0E7_FERPA	UPIMAPI	Prenyltransferase/squalene oxidase		transferase activity [GO:0016740]		sseqid: D3S0E7; pident: 100.0; length: 756; mismatch: 0; gapopen: 0; qstart: 1; qend: 756; sstart: 1; send: 756; evalue: 0.0; bitscore: 1318.0; Entry: D3S0E7; Entry Name: D3S0E7_FERPA; Annotation: 1.0; Pfam: PF14478;PF00432;PF13243;
tr|D3Q5V2|D3Q5V2_STANL	UPIMAPI	Kelch repeat-containing protein		carbohydrate binding [GO:0030246]		sseqid: D3Q5V2; pident: 100.0; length: 1514; mismatch: 0; gapopen: 0; qstart: 1; qend: 1514; sstart: 1; send: 1514; evalue: 0.0; bitscore: 2870.0; Entry: D3Q5V2; Entry Name: D3Q5V2_STANL; Annotation: 1.0; Pfam: PF13620;PF01344;
tr|D3AUU8|D3AUU8_9FIRM	UPIMAPI	Uncharacterized protein				sseqid: D3AUU8; pident: 100.0; length: 196; mismatch: 0; gapopen: 0; qstart: 1; qend: 196; sstart: 1; send: 196; evalue: 9.059999999999997e-131; bitscore: 374.0; Entry: D3AUU8; Entry Name: D3AUU8_9FIRM; Annotation: 1.0
tr|D2Z893|D2Z893_9BACT	UPIMAPI	Uncharacterized protein				sseqid: D2Z893; pident: 100.0; length: 314; mismatch: 0; gapopen: 0; qstart: 1; qend: 314; sstart: 1; send: 314; evalue: 1.2599999999999997e-223; bitscore: 619.0; Entry: D2Z893; Entry Name: D2Z893_9BACT; Annotation: 1.0; Protein families: UPF0065 (bug) family; Pfam: PF03401;
tr|D2Z7Z8|D2Z7Z8_9BACT	UPIMAPI	Phosphate butyryltransferase (EC 2.3.1.19)		phosphate butyryltransferase activity [GO:0050182]	2.3.1.19	sseqid: D2Z7Z8; pident: 100.0; length: 309; mismatch: 0; gapopen: 0; qstart: 1; qend: 309; sstart: 1; send: 309; evalue: 1.819999999999999e-209; bitscore: 583.0; Entry: D2Z7Z8; Entry Name: D2Z7Z8_9BACT; Annotation: 1.0; Protein families: Phosphate acetyltransferase and butyryltransferase family; Pfam: PF01515;
tr|D2Z6S4|D2Z6S4_9BACT	UPIMAPI	Uncharacterized protein				sseqid: D2Z6S4; pident: 100.0; length: 234; mismatch: 0; gapopen: 0; qstart: 1; qend: 234; sstart: 1; send: 234; evalue: 3.119999999999999e-143; bitscore: 409.0; Entry: D2Z6S4; Entry Name: D2Z6S4_9BACT; Annotation: 1.0
tr|D2Z6B3|D2Z6B3_9BACT	UPIMAPI	3-methyl-2-oxobutanoate hydroxymethyltransferase (EC 2.1.2.11) (Ketopantoate hydroxymethyltransferase) (KPHMT)	FUNCTION: Catalyzes the reversible reaction in which hydroxymethyl group from 5,10-methylenetetrahydrofolate is transferred onto alpha-ketoisovalerate to form ketopantoate. {ECO:0000256|HAMAP-Rule:MF_00156}.	cytoplasm [GO:0005737]; 3-methyl-2-oxobutanoate hydroxymethyltransferase activity [GO:0003864]; magnesium ion binding [GO:0000287]; methyltransferase activity [GO:0008168]; methylation [GO:0032259]; pantothenate biosynthetic process [GO:0015940]	2.1.2.11	sseqid: D2Z6B3; pident: 100.0; length: 290; mismatch: 0; gapopen: 0; qstart: 1; qend: 290; sstart: 1; send: 290; evalue: 2.0699999999999998e-210; bitscore: 583.0; Entry: D2Z6B3; Entry Name: D2Z6B3_9BACT; Annotation: 3.0; Protein families: PanB family; Pfam: PF02548;
tr|D2Z620|D2Z620_9BACT	UPIMAPI	Extracellular ligand-binding receptor		amino acid transport [GO:0006865]		sseqid: D2Z620; pident: 100.0; length: 383; mismatch: 0; gapopen: 0; qstart: 1; qend: 383; sstart: 1; send: 383; evalue: 1.0399999999999996e-275; bitscore: 756.0; Entry: D2Z620; Entry Name: D2Z620_9BACT; Annotation: 1.0; Protein families: Leucine-binding protein family; Pfam: PF13458;
tr|D2Z600|D2Z600_9BACT	UPIMAPI	TRAP dicarboxylate transporter, DctP subunit		outer membrane-bounded periplasmic space [GO:0030288]; transmembrane transport [GO:0055085]		sseqid: D2Z600; pident: 100.0; length: 340; mismatch: 0; gapopen: 0; qstart: 1; qend: 340; sstart: 1; send: 340; evalue: 2.809999999999998e-240; bitscore: 663.0; Entry: D2Z600; Entry Name: D2Z600_9BACT; Annotation: 1.0; Protein families: Bacterial solute-binding protein 7 family; Pfam: PF03480;
tr|D2Z5B7|D2Z5B7_9BACT	UPIMAPI	TRAP transporter solute receptor, TAXI family				sseqid: D2Z5B7; pident: 100.0; length: 316; mismatch: 0; gapopen: 0; qstart: 1; qend: 316; sstart: 1; send: 316; evalue: 1.2999999999999994e-217; bitscore: 604.0; Entry: D2Z5B7; Entry Name: D2Z5B7_9BACT; Annotation: 1.0; Pfam: PF16868;
tr|D2Z542|D2Z542_9BACT	UPIMAPI	Glutamate dehydrogenase		glutamate dehydrogenase (NAD+) activity [GO:0004352]; nucleotide binding [GO:0000166]; glutamate catabolic process [GO:0006538]		sseqid: D2Z542; pident: 100.0; length: 425; mismatch: 0; gapopen: 0; qstart: 1; qend: 425; sstart: 1; send: 425; evalue: 0.0; bitscore: 865.0; Entry: D2Z542; Entry Name: D2Z542_9BACT; Annotation: 2.0; Protein families: Glu/Leu/Phe/Val dehydrogenases family; Pfam: PF00208;PF02812;
tr|D2RLS4|D2RLS4_ACIFV	UPIMAPI	S-layer domain protein				sseqid: D2RLS4; pident: 100.0; length: 433; mismatch: 0; gapopen: 0; qstart: 1; qend: 433; sstart: 1; send: 433; evalue: 2.36e-311; bitscore: 851.0; Entry: D2RLS4; Entry Name: D2RLS4_ACIFV; Annotation: 1.0; Pfam: PF00395;
tr|D2R336|D2R336_PIRSD	UPIMAPI	Autotransporter-associated beta strand repeat protein		extracellular region [GO:0005576]; calcium ion binding [GO:0005509]		sseqid: D2R336; pident: 100.0; length: 2976; mismatch: 0; gapopen: 0; qstart: 1; qend: 2976; sstart: 1; send: 2976; evalue: 0.0; bitscore: 4776.0; Entry: D2R336; Entry Name: D2R336_PIRSD; Annotation: 1.0; Pfam: PF00353;PF12951;
tr|D2QSI0|D2QSI0_SPILD	UPIMAPI	RagB/SusD domain protein		cell outer membrane [GO:0009279]		sseqid: D2QSI0; pident: 100.0; length: 601; mismatch: 0; gapopen: 0; qstart: 1; qend: 601; sstart: 1; send: 601; evalue: 0.0; bitscore: 1216.0; Entry: D2QSI0; Entry Name: D2QSI0_SPILD; Annotation: 1.0; Protein families: SusD family; Pfam: PF14322;PF07980;
tr|D2KZW2|D2KZW2_9EURY	UPIMAPI	coenzyme-B sulfoethylthiotransferase (EC 2.8.4.1)		coenzyme-B sulfoethylthiotransferase activity [GO:0050524]; metal ion binding [GO:0046872]; methanogenesis [GO:0015948]	2.8.4.1	sseqid: D2KZW2; pident: 100.0; length: 382; mismatch: 0; gapopen: 0; qstart: 1; qend: 382; sstart: 1; send: 382; evalue: 3.809999999999998e-282; bitscore: 773.0; Entry: D2KZW2; Entry Name: D2KZW2_9EURY; Annotation: 2.0; Protein families: Methyl-coenzyme M reductase alpha subunit family; Pfam: PF02249;PF02745;
tr|D1YVB1|D1YVB1_METPS	UPIMAPI	Phage tail sheath protein				sseqid: D1YVB1; pident: 100.0; length: 449; mismatch: 0; gapopen: 0; qstart: 1; qend: 449; sstart: 1; send: 449; evalue: 1.23e-312; bitscore: 855.0; Entry: D1YVB1; Entry Name: D1YVB1_METPS; Annotation: 1.0; Protein families: Myoviridae tail sheath protein family; Pfam: PF04984;PF17482;
tr|D1VU60|D1VU60_9FIRM	UPIMAPI	TRAP transporter solute receptor, DctP family		outer membrane-bounded periplasmic space [GO:0030288]; transmembrane transport [GO:0055085]		sseqid: D1VU60; pident: 100.0; length: 343; mismatch: 0; gapopen: 0; qstart: 1; qend: 343; sstart: 1; send: 343; evalue: 2.049999999999999e-239; bitscore: 661.0; Entry: D1VU60; Entry Name: D1VU60_9FIRM; Annotation: 1.0; Protein families: Bacterial solute-binding protein 7 family; Pfam: PF03480;
tr|D1JBL9|D1JBL9_UNCAX	UPIMAPI	Putative iron(III) ABC transporter, solute-binding protein		polysaccharide catabolic process [GO:0000272]		sseqid: D1JBL9; pident: 100.0; length: 354; mismatch: 0; gapopen: 0; qstart: 1; qend: 354; sstart: 1; send: 354; evalue: 4.419999999999998e-235; bitscore: 651.0; Entry: D1JBL9; Entry Name: D1JBL9_UNCAX; Annotation: 1.0; Pfam: PF01497;
tr|D1CD68|D1CD68_THET1	UPIMAPI	Elongation factor Tu (EF-Tu)	FUNCTION: This protein promotes the GTP-dependent binding of aminoacyl-tRNA to the A-site of ribosomes during protein biosynthesis. {ECO:0000256|HAMAP-Rule:MF_00118}.	cytosol [GO:0005829]; GTP binding [GO:0005525]; GTPase activity [GO:0003924]; translation elongation factor activity [GO:0003746]		sseqid: D1CD68; pident: 100.0; length: 400; mismatch: 0; gapopen: 0; qstart: 1; qend: 400; sstart: 1; send: 400; evalue: 2.5199999999999983e-287; bitscore: 787.0; Entry: D1CD68; Entry Name: D1CD68_THET1; Annotation: 2.0; Protein families: TRAFAC class translation factor GTPase superfamily, Classic translation factor GTPase family, EF-Tu/EF-1A subfamily; Pfam: PF00009;PF03144;PF03143;
tr|D1BXH6|D1BXH6_XYLCX	UPIMAPI	Alpha-1,6-glucosidase, pullulanase-type		alpha-amylase activity [GO:0004556]; cation binding [GO:0043169]; pullulanase activity [GO:0051060]; carbohydrate metabolic process [GO:0005975]		sseqid: D1BXH6; pident: 100.0; length: 1891; mismatch: 0; gapopen: 0; qstart: 1; qend: 1891; sstart: 1; send: 1891; evalue: 0.0; bitscore: 3656.0; Entry: D1BXH6; Entry Name: D1BXH6_XYLCX; Annotation: 1.0; Protein families: Glycosyl hydrolase 13 family; Pfam: PF00128;PF02806;PF02922;PF11852;PF17967;PF22058;
tr|D1B8K5|D1B8K5_THEAS	UPIMAPI	TRAP transporter solute receptor, TAXI family				sseqid: D1B8K5; pident: 100.0; length: 329; mismatch: 0; gapopen: 0; qstart: 1; qend: 329; sstart: 1; send: 329; evalue: 1.4299999999999992e-232; bitscore: 643.0; Entry: D1B8K5; Entry Name: D1B8K5_THEAS; Annotation: 1.0; Pfam: PF16868;
tr|D1B8F3|D1B8F3_THEAS	UPIMAPI	Glutamate dehydrogenase		glutamate dehydrogenase (NAD+) activity [GO:0004352]; nucleotide binding [GO:0000166]; glutamate catabolic process [GO:0006538]		sseqid: D1B8F3; pident: 100.0; length: 424; mismatch: 0; gapopen: 0; qstart: 1; qend: 424; sstart: 1; send: 424; evalue: 1.05e-315; bitscore: 862.0; Entry: D1B8F3; Entry Name: D1B8F3_THEAS; Annotation: 2.0; Protein families: Glu/Leu/Phe/Val dehydrogenases family; Pfam: PF00208;PF02812;
tr|D1B7V7|D1B7V7_THEAS	UPIMAPI	DUF3798 domain-containing protein				sseqid: D1B7V7; pident: 100.0; length: 397; mismatch: 0; gapopen: 0; qstart: 1; qend: 397; sstart: 1; send: 397; evalue: 4.0199999999999974e-287; bitscore: 786.0; Entry: D1B7V7; Entry Name: D1B7V7_THEAS; Annotation: 1.0; Pfam: PF12683;
tr|D1B6N2|D1B6N2_THEAS	UPIMAPI	TRAP dicarboxylate transporter-DctP subunit		transmembrane transport [GO:0055085]		sseqid: D1B6N2; pident: 100.0; length: 329; mismatch: 0; gapopen: 0; qstart: 1; qend: 329; sstart: 1; send: 329; evalue: 1.7399999999999989e-233; bitscore: 645.0; Entry: D1B6N2; Entry Name: D1B6N2_THEAS; Annotation: 1.0; Protein families: Bacterial solute-binding protein 7 family; Pfam: PF03480;
tr|D1B6I2|D1B6I2_THEAS	UPIMAPI	Extracellular ligand-binding receptor		amino acid transport [GO:0006865]		sseqid: D1B6I2; pident: 100.0; length: 382; mismatch: 0; gapopen: 0; qstart: 1; qend: 382; sstart: 1; send: 382; evalue: 2.5399999999999983e-271; bitscore: 745.0; Entry: D1B6I2; Entry Name: D1B6I2_THEAS; Annotation: 1.0; Protein families: Leucine-binding protein family; Pfam: PF13458;
tr|D1B5S7|D1B5S7_THEAS	UPIMAPI	Selenoprotein B, glycine/betaine/sarcosine/D-proline reductase family		glycine reductase complex [GO:0030700]; glycine reductase activity [GO:0030699]		sseqid: D1B5S7; pident: 100.0; length: 436; mismatch: 0; gapopen: 0; qstart: 1; qend: 436; sstart: 1; send: 436; evalue: 1.8e-312; bitscore: 854.0; Entry: D1B5S7; Entry Name: D1B5S7_THEAS; Annotation: 1.0; Protein families: GrdB/GrdF/GrdH family; Pfam: PF07355;
tr|D1AP24|D1AP24_SEBTE	UPIMAPI	Hydrogenase, Fe-only		4 iron, 4 sulfur cluster binding [GO:0051539]; ferredoxin hydrogenase activity [GO:0008901]; iron ion binding [GO:0005506]		sseqid: D1AP24; pident: 100.0; length: 587; mismatch: 0; gapopen: 0; qstart: 1; qend: 587; sstart: 1; send: 587; evalue: 0.0; bitscore: 1165.0; Entry: D1AP24; Entry Name: D1AP24_SEBTE; Annotation: 1.0; Pfam: PF02906;PF02256;PF13510;PF12838;PF10588;
tr|D0QZ27|D0QZ27_9ACTN	UPIMAPI	nitrogenase (EC 1.18.6.1)	FUNCTION: The key enzymatic reactions in nitrogen fixation are catalyzed by the nitrogenase complex, which has 2 components: the iron protein and the molybdenum-iron protein. {ECO:0000256|ARBA:ARBA00002234}.	4 iron, 4 sulfur cluster binding [GO:0051539]; ATP binding [GO:0005524]; metal ion binding [GO:0046872]; oxidoreductase activity [GO:0016491]	1.18.6.1	sseqid: D0QZ27; pident: 100.0; length: 194; mismatch: 0; gapopen: 0; qstart: 1; qend: 194; sstart: 1; send: 194; evalue: 1.459999999999999e-135; bitscore: 386.0; Entry: D0QZ27; Entry Name: D0QZ27_9ACTN; Annotation: 2.0; Protein families: NifH/BchL/ChlL family; Pfam: PF00142;
tr|D0MDP2|D0MDP2_RHOM4	UPIMAPI	TonB-dependent outer membrane receptor		cell outer membrane [GO:0009279]; siderophore uptake transmembrane transporter activity [GO:0015344]		sseqid: D0MDP2; pident: 100.0; length: 1041; mismatch: 0; gapopen: 0; qstart: 1; qend: 1041; sstart: 1; send: 1041; evalue: 0.0; bitscore: 2096.0; Entry: D0MDP2; Entry Name: D0MDP2_RHOM4; Annotation: 1.0; Pfam: PF13620;
tr|D0LUK3|D0LUK3_HALO1	UPIMAPI	2,3-bisphosphoglycerate-independent phosphoglycerate mutase (EC 5.4.2.12)		cytoplasm [GO:0005737]; manganese ion binding [GO:0030145]; phosphoglycerate mutase activity [GO:0004619]; glucose catabolic process [GO:0006007]; glycolytic process [GO:0006096]	5.4.2.12	sseqid: D0LUK3; pident: 100.0; length: 552; mismatch: 0; gapopen: 0; qstart: 1; qend: 552; sstart: 1; send: 552; evalue: 0.0; bitscore: 1121.0; Entry: D0LUK3; Entry Name: D0LUK3_HALO1; Annotation: 2.0; Protein families: BPG-independent phosphoglycerate mutase family; Pfam: PF06415;PF01676;
tr|D0F138|D0F138_9GENT	UPIMAPI	Ribulose bisphosphate carboxylase large chain (EC 4.1.1.39)	FUNCTION: RuBisCO catalyzes two reactions: the carboxylation of D-ribulose 1,5-bisphosphate, the primary event in carbon dioxide fixation, as well as the oxidative fragmentation of the pentose substrate in the photorespiration process. Both reactions occur simultaneously and in competition at the same active site. {ECO:0000256|ARBA:ARBA00025664}.	chloroplast [GO:0009507]; magnesium ion binding [GO:0000287]; monooxygenase activity [GO:0004497]; ribulose-bisphosphate carboxylase activity [GO:0016984]; photorespiration [GO:0009853]; reductive pentose-phosphate cycle [GO:0019253]	4.1.1.39	sseqid: D0F138; pident: 100.0; length: 184; mismatch: 0; gapopen: 0; qstart: 1; qend: 184; sstart: 1; send: 184; evalue: 3.7699999999999995e-133; bitscore: 379.0; Entry: D0F138; Entry Name: D0F138_9GENT; Annotation: 2.0; Protein families: RuBisCO large chain family, Type I subfamily; Pfam: PF00016;PF02788;
tr|C9RDF9|C9RDF9_AMMDK	UPIMAPI	Copper amine oxidase domain protein				sseqid: C9RDF9; pident: 100.0; length: 1118; mismatch: 0; gapopen: 0; qstart: 1; qend: 1118; sstart: 1; send: 1118; evalue: 0.0; bitscore: 2078.0; Entry: C9RDF9; Entry Name: C9RDF9_AMMDK; Annotation: 1.0; Pfam: PF07833;
tr|C9RD81|C9RD81_AMMDK	UPIMAPI	Adenylylsulfate reductase, beta subunit		4 iron, 4 sulfur cluster binding [GO:0051539]; metal ion binding [GO:0046872]		sseqid: C9RD81; pident: 100.0; length: 147; mismatch: 0; gapopen: 0; qstart: 1; qend: 147; sstart: 1; send: 147; evalue: 1.3999999999999997e-110; bitscore: 319.0; Entry: C9RD81; Entry Name: C9RD81_AMMDK; Annotation: 1.0; Pfam: PF12139;PF12838;
tr|C8X3U5|C8X3U5_DESRD	UPIMAPI	Aldehyde oxidase and xanthine dehydrogenase molybdopterin binding protein		2 iron, 2 sulfur cluster binding [GO:0051537]; iron ion binding [GO:0005506]; oxidoreductase activity [GO:0016491]		sseqid: C8X3U5; pident: 100.0; length: 904; mismatch: 0; gapopen: 0; qstart: 1; qend: 904; sstart: 1; send: 904; evalue: 0.0; bitscore: 1821.0; Entry: C8X3U5; Entry Name: C8X3U5_DESRD; Annotation: 1.0; Protein families: Xanthine dehydrogenase family; Pfam: PF01315;PF00111;PF01799;PF02738;PF20256;
tr|C8W2N3|C8W2N3_DESAS	UPIMAPI	Iron-containing alcohol dehydrogenase		alcohol dehydrogenase (NAD+) activity [GO:0004022]; metal ion binding [GO:0046872]		sseqid: C8W2N3; pident: 100.0; length: 387; mismatch: 0; gapopen: 0; qstart: 1; qend: 387; sstart: 1; send: 387; evalue: 2.2599999999999982e-272; bitscore: 748.0; Entry: C8W2N3; Entry Name: C8W2N3_DESAS; Annotation: 1.0; Protein families: Iron-containing alcohol dehydrogenase family; Pfam: PF00465;
tr|C8VVT9|C8VVT9_DESAS	UPIMAPI	Formate dehydrogenase, alpha subunit		membrane [GO:0016020]; 2 iron, 2 sulfur cluster binding [GO:0051537]; 4 iron, 4 sulfur cluster binding [GO:0051539]; formate dehydrogenase (NAD+) activity [GO:0008863]; metal ion binding [GO:0046872]; molybdopterin cofactor binding [GO:0043546]; NADH dehydrogenase activity [GO:0003954]; formate metabolic process [GO:0015942]; respiratory electron transport chain [GO:0022904]		sseqid: C8VVT9; pident: 100.0; length: 893; mismatch: 0; gapopen: 0; qstart: 1; qend: 893; sstart: 1; send: 893; evalue: 0.0; bitscore: 1799.0; Entry: C8VVT9; Entry Name: C8VVT9_DESAS; Annotation: 2.0; Protein families: Prokaryotic molybdopterin-containing oxidoreductase family; Pfam: PF13510;PF04879;PF00384;PF01568;PF10588;PF22117;
tr|C7X601|C7X601_9BACT	UPIMAPI	TonB dependent receptor		cell outer membrane [GO:0009279]		sseqid: A0A6N3H1F0; pident: 100.0; length: 926; mismatch: 0; gapopen: 0; qstart: 1; qend: 926; sstart: 1; send: 926; evalue: 0.0; bitscore: 1872.0; Entry: A0A6N3H1F0; Entry Name: A0A6N3H1F0_9BACT; Annotation: 1.0; Protein families: TonB-dependent receptor family; Pfam: PF07715;PF00593;
tr|C7X600|C7X600_9BACT	UPIMAPI	SusD family protein		cell outer membrane [GO:0009279]		sseqid: A0A6N3H060; pident: 100.0; length: 518; mismatch: 0; gapopen: 0; qstart: 1; qend: 518; sstart: 1; send: 518; evalue: 0.0; bitscore: 1079.0; Entry: A0A6N3H060; Entry Name: A0A6N3H060_9BACT; Annotation: 1.0; Protein families: SusD family; Pfam: PF14322;PF07980;
tr|C7LX62|C7LX62_DESBD	UPIMAPI	Extracellular ligand-binding receptor				sseqid: C7LX62; pident: 100.0; length: 371; mismatch: 0; gapopen: 0; qstart: 1; qend: 371; sstart: 1; send: 371; evalue: 3.029999999999998e-262; bitscore: 721.0; Entry: C7LX62; Entry Name: C7LX62_DESBD; Annotation: 1.0; Protein families: Leucine-binding protein family; Pfam: PF13458;
tr|C7LSV1|C7LSV1_DESBD	UPIMAPI	Chaperonin GroEL (EC 5.6.1.7) (60 kDa chaperonin) (Chaperonin-60) (Cpn60)	FUNCTION: Together with its co-chaperonin GroES, plays an essential role in assisting protein folding. The GroEL-GroES system forms a nano-cage that allows encapsulation of the non-native substrate proteins and provides a physical environment optimized to promote and accelerate protein folding. {ECO:0000256|HAMAP-Rule:MF_00600, ECO:0000256|RuleBase:RU000419}.	cytoplasm [GO:0005737]; ATP binding [GO:0005524]; ATP-dependent protein folding chaperone [GO:0140662]; isomerase activity [GO:0016853]; unfolded protein binding [GO:0051082]; protein refolding [GO:0042026]	5.6.1.7	sseqid: C7LSV1; pident: 100.0; length: 545; mismatch: 0; gapopen: 0; qstart: 1; qend: 545; sstart: 1; send: 545; evalue: 0.0; bitscore: 1007.0; Entry: C7LSV1; Entry Name: C7LSV1_DESBD; Annotation: 3.0; Protein families: Chaperonin (HSP60) family; Pfam: PF00118;
tr|C7LP88|C7LP88_DESBD	UPIMAPI	Iron-containing alcohol dehydrogenase		alcohol dehydrogenase (NAD+) activity [GO:0004022]; metal ion binding [GO:0046872]		sseqid: C7LP88; pident: 100.0; length: 393; mismatch: 0; gapopen: 0; qstart: 1; qend: 393; sstart: 1; send: 393; evalue: 9.409999999999996e-284; bitscore: 778.0; Entry: C7LP88; Entry Name: C7LP88_DESBD; Annotation: 1.0; Protein families: Iron-containing alcohol dehydrogenase family; Pfam: PF00465;
tr|C7JA53|C7JA53_ORYSJ	UPIMAPI	Os12g0176600 protein		nucleus [GO:0005634]		sseqid: C7JA53; pident: 100.0; length: 740; mismatch: 0; gapopen: 0; qstart: 1; qend: 740; sstart: 1; send: 740; evalue: 0.0; bitscore: 1329.0; Entry: C7JA53; Entry Name: C7JA53_ORYSJ; Annotation: 1.0; Pfam: PF00249;PF04433;PF16495;
tr|C7H507|C7H507_FAED2	UPIMAPI	Tat pathway signal sequence domain protein		cell envelope [GO:0030313]; peptide transmembrane transporter activity [GO:1904680]; peptide transport [GO:0015833]		sseqid: C7H507; pident: 100.0; length: 676; mismatch: 0; gapopen: 0; qstart: 1; qend: 676; sstart: 1; send: 676; evalue: 0.0; bitscore: 1365.0; Entry: C7H507; Entry Name: C7H507_FAED2; Annotation: 1.0; Protein families: Bacterial solute-binding protein 5 family; Pfam: PF00496;PF10518;
tr|C6Y1A5|C6Y1A5_PEDHD	UPIMAPI	DUF3575 domain-containing protein				sseqid: C6Y1A5; pident: 100.0; length: 175; mismatch: 0; gapopen: 0; qstart: 1; qend: 175; sstart: 1; send: 175; evalue: 8.989999999999999e-123; bitscore: 352.0; Entry: C6Y1A5; Entry Name: C6Y1A5_PEDHD; Annotation: 1.0; Pfam: PF12099;
tr|C6XKL1|C6XKL1_HIRBI	UPIMAPI	Peptide chain release factor 2 (RF-2)	FUNCTION: Peptide chain release factor 2 directs the termination of translation in response to the peptide chain termination codons UGA and UAA. {ECO:0000256|HAMAP-Rule:MF_00094}.	cytoplasm [GO:0005737]; translation release factor activity, codon specific [GO:0016149]		sseqid: C6XKL1; pident: 100.0; length: 370; mismatch: 0; gapopen: 0; qstart: 1; qend: 370; sstart: 1; send: 370; evalue: 7.699999999999996e-260; bitscore: 715.0; Entry: C6XKL1; Entry Name: C6XKL1_HIRBI; Annotation: 2.0; Protein families: Prokaryotic/mitochondrial release factor family; Pfam: PF03462;PF00472;
tr|C6PW09|C6PW09_9CLOT	UPIMAPI	Phenylalanine--tRNA ligase beta subunit (EC 6.1.1.20) (Phenylalanyl-tRNA synthetase beta subunit) (PheRS)		phenylalanine-tRNA ligase complex [GO:0009328]; ATP binding [GO:0005524]; magnesium ion binding [GO:0000287]; phenylalanine-tRNA ligase activity [GO:0004826]; tRNA binding [GO:0000049]; phenylalanyl-tRNA aminoacylation [GO:0006432]	6.1.1.20	sseqid: C6PW09; pident: 100.0; length: 793; mismatch: 0; gapopen: 0; qstart: 1; qend: 793; sstart: 1; send: 793; evalue: 0.0; bitscore: 1552.0; Entry: C6PW09; Entry Name: C6PW09_9CLOT; Annotation: 3.0; Protein families: Phenylalanyl-tRNA synthetase beta subunit family, Type 1 subfamily; Pfam: PF03483;PF03484;PF03147;PF01588;PF17759;
tr|C6LEX0|C6LEX0_9FIRM	UPIMAPI	Ethanolamine utilization protein EutM		bacterial microcompartment [GO:0031469]		sseqid: A0A1H7ZKH9; pident: 95.7; length: 94; mismatch: 4; gapopen: 0; qstart: 1; qend: 94; sstart: 1; send: 94; evalue: 3.39e-50; bitscore: 162.0; Entry: A0A1H7ZKH9; Entry Name: A0A1H7ZKH9_9FIRM; Annotation: 1.0; Protein families: Bacterial microcompartments protein family, CsoS1 subfamily; Pfam: PF00936;
