qseqid	tool	Protein names	Function [CC]	Gene Ontology (GO)	EC number	extra
tr|F4BZ00|F4BZ00_METSG	UPIMAPI	V-type ATP synthase subunit D (V-ATPase subunit D)	FUNCTION: Produces ATP from ADP in the presence of a proton gradient across the membrane. {ECO:0000256|ARBA:ARBA00003543, ECO:0000256|HAMAP-Rule:MF_00271}.	ATP binding [GO:0005524]; proton-transporting ATP synthase activity, rotational mechanism [GO:0046933]; proton-transporting ATPase activity, rotational mechanism [GO:0046961]; proton motive force-driven plasma membrane ATP synthesis [GO:0042777]		sseqid: A0A1V4VE95; pident: 100.0; length: 231; mismatch: 0; gapopen: 0; qstart: 1; qend: 231; sstart: 1; send: 231; evalue: 1.4999999999999996e-144; bitscore: 412.0; Entry: A0A1V4VE95; Entry Name: A0A1V4VE95_9EURY; Annotation: 2.0; Protein families: V-ATPase D subunit family; Pfam: PF01813;
tr|F4BYZ8|F4BYZ8_METSG	UPIMAPI	Tryptophan synthase beta chain (EC 4.2.1.20)	FUNCTION: The beta subunit is responsible for the synthesis of L-tryptophan from indole and L-serine. {ECO:0000256|ARBA:ARBA00002786, ECO:0000256|HAMAP-Rule:MF_00133}.	cytoplasm [GO:0005737]; L-serine hydro-lyase (adding indole, L-tryptophan-forming) activity [GO:0052684]; pyridoxal phosphate binding [GO:0030170]; tryptophan synthase activity [GO:0004834]	4.2.1.20	sseqid: F4BYZ8; pident: 100.0; length: 450; mismatch: 0; gapopen: 0; qstart: 1; qend: 450; sstart: 1; send: 450; evalue: 0.0; bitscore: 921.0; Entry: F4BYZ8; Entry Name: F4BYZ8_METSG; Annotation: 2.0; Protein families: TrpB family; Pfam: PF00291;
tr|F4BYZ7|F4BYZ7_METSG	UPIMAPI	Soluble hydrogenase small subunit (EC 1.12.-.-)		alanine-glyoxylate transaminase activity [GO:0008453]; L-serine-pyruvate transaminase activity [GO:0004760]; oxidoreductase activity [GO:0016491]; glycine biosynthetic process, by transamination of glyoxylate [GO:0019265]	1.12.-.-	sseqid: F4BYZ7; pident: 100.0; length: 381; mismatch: 0; gapopen: 0; qstart: 1; qend: 381; sstart: 1; send: 381; evalue: 6.169999999999997e-267; bitscore: 734.0; Entry: F4BYZ7; Entry Name: F4BYZ7_METSG; Annotation: 1.0; Protein families: Class-V pyridoxal-phosphate-dependent aminotransferase family; Pfam: PF00266;
tr|F4BYZ5|F4BYZ5_METSG	UPIMAPI	Uncharacterized protein				sseqid: F4BYZ5; pident: 100.0; length: 263; mismatch: 0; gapopen: 0; qstart: 1; qend: 263; sstart: 1; send: 263; evalue: 1.8799999999999995e-188; bitscore: 526.0; Entry: F4BYZ5; Entry Name: F4BYZ5_METSG; Annotation: 1.0
tr|F4BYZ4|F4BYZ4_METSG	UPIMAPI	DUF4198 domain-containing protein				sseqid: F4BYZ4; pident: 100.0; length: 308; mismatch: 0; gapopen: 0; qstart: 1; qend: 308; sstart: 1; send: 308; evalue: 1.5899999999999994e-223; bitscore: 618.0; Entry: F4BYZ4; Entry Name: F4BYZ4_METSG; Annotation: 1.0; Pfam: PF10670;
tr|F4BYY7|F4BYY7_METSG	UPIMAPI	DUF4198 domain-containing protein				sseqid: A0A7K4AJ88; pident: 100.0; length: 256; mismatch: 0; gapopen: 0; qstart: 1; qend: 256; sstart: 1; send: 256; evalue: 2.1199999999999988e-186; bitscore: 520.0; Entry: A0A7K4AJ88; Entry Name: A0A7K4AJ88_METSH; Annotation: 1.0; Pfam: PF10670;
tr|F4BYY6|F4BYY6_METSG	UPIMAPI	DUF4198 domain-containing protein				sseqid: F4BYY6; pident: 100.0; length: 248; mismatch: 0; gapopen: 0; qstart: 1; qend: 248; sstart: 1; send: 248; evalue: 1.0899999999999997e-184; bitscore: 515.0; Entry: F4BYY6; Entry Name: F4BYY6_METSG; Annotation: 1.0; Pfam: PF10670;
tr|F4BYY2|F4BYY2_METSG	UPIMAPI	Putative nickel-responsive regulator	FUNCTION: Transcriptional regulator. {ECO:0000256|ARBA:ARBA00002339, ECO:0000256|HAMAP-Rule:MF_00476}.	DNA binding [GO:0003677]; DNA-binding transcription factor activity [GO:0003700]; nickel cation binding [GO:0016151]; response to nickel cation [GO:0010045]		sseqid: F4BYY2; pident: 100.0; length: 135; mismatch: 0; gapopen: 0; qstart: 1; qend: 135; sstart: 1; send: 135; evalue: 7.769999999999999e-91; bitscore: 268.0; Entry: F4BYY2; Entry Name: F4BYY2_METSG; Annotation: 2.0; Protein families: Transcriptional regulatory CopG/NikR family; Pfam: PF08753;PF01402;
tr|F4BYY1|F4BYY1_METSG	UPIMAPI	TPR-repeat protein				sseqid: F4BYY1; pident: 100.0; length: 78; mismatch: 0; gapopen: 0; qstart: 1; qend: 78; sstart: 1; send: 78; evalue: 2.12e-41; bitscore: 164.0; Entry: F4BYY1; Entry Name: F4BYY1_METSG; Annotation: 1.0; Pfam: PF00515;PF13432;PF13174;PF13181;
tr|F4BYY0|F4BYY0_METSG	UPIMAPI	2-isopropylmalate synthase (EC 2.3.3.13) (Alpha-IPM synthase) (Alpha-isopropylmalate synthase)	FUNCTION: Catalyzes the condensation of the acetyl group of acetyl-CoA with 3-methyl-2-oxobutanoate (2-oxoisovalerate) to form 3-carboxy-3-hydroxy-4-methylpentanoate (2-isopropylmalate). {ECO:0000256|ARBA:ARBA00003715}.	2-isopropylmalate synthase activity [GO:0003852]; coenzyme B biosynthetic process [GO:0019298]; L-leucine biosynthetic process [GO:0009098]	2.3.3.13	sseqid: A0A843K1C6; pident: 100.0; length: 518; mismatch: 0; gapopen: 0; qstart: 1; qend: 518; sstart: 1; send: 518; evalue: 0.0; bitscore: 992.0; Entry: A0A843K1C6; Entry Name: A0A843K1C6_9EURY; Annotation: 2.0; Protein families: Alpha-IPM synthase/homocitrate synthase family; Pfam: PF22617;PF00682;PF08502;
tr|F4BYW8|F4BYW8_METSG	UPIMAPI	Orotidine 5'-phosphate decarboxylase (EC 4.1.1.23) (OMP decarboxylase) (OMPDCase) (OMPdecase)	FUNCTION: Catalyzes the decarboxylation of orotidine 5'-monophosphate (OMP) to uridine 5'-monophosphate (UMP). {ECO:0000256|HAMAP-Rule:MF_01200}.	cytosol [GO:0005829]; orotidine-5'-phosphate decarboxylase activity [GO:0004590]; 'de novo' pyrimidine nucleobase biosynthetic process [GO:0006207]; 'de novo' UMP biosynthetic process [GO:0044205]	4.1.1.23	sseqid: A0A7K4AKM0; pident: 100.0; length: 219; mismatch: 0; gapopen: 0; qstart: 1; qend: 219; sstart: 1; send: 219; evalue: 1.65e-142; bitscore: 406.0; Entry: A0A7K4AKM0; Entry Name: A0A7K4AKM0_METSH; Annotation: 3.0; Protein families: OMP decarboxylase family, Type 1 subfamily; Pfam: PF00215;
tr|F4BYW1|F4BYW1_METSG	UPIMAPI	VWA domain-containing protein				sseqid: F4BYW1; pident: 100.0; length: 726; mismatch: 0; gapopen: 0; qstart: 1; qend: 726; sstart: 1; send: 726; evalue: 0.0; bitscore: 1408.0; Entry: F4BYW1; Entry Name: F4BYW1_METSG; Annotation: 1.0; Pfam: PF08487;PF00092;
tr|F4BYT8|F4BYT8_METSG	UPIMAPI	Putative ABC transporter periplasmic-binding protein		ATP-binding cassette (ABC) transporter complex [GO:0043190]; periplasmic space [GO:0042597]; peptide transmembrane transporter activity [GO:1904680]; peptide transport [GO:0015833]		sseqid: A0A1V5B6E1; pident: 100.0; length: 532; mismatch: 0; gapopen: 0; qstart: 1; qend: 532; sstart: 1; send: 532; evalue: 0.0; bitscore: 1073.0; Entry: A0A1V5B6E1; Entry Name: A0A1V5B6E1_9EURY; Annotation: 1.0; Pfam: PF00496;
tr|F4BYT2|F4BYT2_METSG	UPIMAPI	Periplasmic binding protein				sseqid: F4BYT2; pident: 100.0; length: 360; mismatch: 0; gapopen: 0; qstart: 1; qend: 360; sstart: 1; send: 360; evalue: 6.359999999999997e-263; bitscore: 722.0; Entry: F4BYT2; Entry Name: F4BYT2_METSG; Annotation: 1.0; Pfam: PF01497;
tr|F4BYS5|F4BYS5_METSG	UPIMAPI	DJ-1/PfpI family protein		cytoplasm [GO:0005737]		sseqid: F4BYS5; pident: 100.0; length: 185; mismatch: 0; gapopen: 0; qstart: 1; qend: 185; sstart: 1; send: 185; evalue: 9.929999999999995e-125; bitscore: 358.0; Entry: F4BYS5; Entry Name: F4BYS5_METSG; Annotation: 1.0; Pfam: PF01965;
tr|F4BYQ0|F4BYQ0_METSG	UPIMAPI	Amino acid-binding protein				sseqid: A0A1V4V1D3; pident: 100.0; length: 167; mismatch: 0; gapopen: 0; qstart: 1; qend: 167; sstart: 1; send: 167; evalue: 6.389999999999998e-110; bitscore: 319.0; Entry: A0A1V4V1D3; Entry Name: A0A1V4V1D3_9EURY; Annotation: 1.0
tr|F4BYP5|F4BYP5_METSG	UPIMAPI	Glutamate-1-semialdehyde 2,1-aminomutase (GSA) (EC 5.4.3.8) (Glutamate-1-semialdehyde aminotransferase) (GSA-AT)		cytoplasm [GO:0005737]; glutamate-1-semialdehyde 2,1-aminomutase activity [GO:0042286]; pyridoxal phosphate binding [GO:0030170]; transaminase activity [GO:0008483]; protoporphyrinogen IX biosynthetic process [GO:0006782]	5.4.3.8	sseqid: F4BYP5; pident: 100.0; length: 423; mismatch: 0; gapopen: 0; qstart: 1; qend: 423; sstart: 1; send: 423; evalue: 8.85e-311; bitscore: 848.0; Entry: F4BYP5; Entry Name: F4BYP5_METSG; Annotation: 2.0; Protein families: Class-III pyridoxal-phosphate-dependent aminotransferase family, HemL subfamily; Pfam: PF00202;
tr|F4BYP3|F4BYP3_METSG	UPIMAPI	Trk system potassium uptake protein	FUNCTION: Part of a potassium transport system. {ECO:0000256|ARBA:ARBA00003660}.	plasma membrane [GO:0005886]; potassium ion transmembrane transporter activity [GO:0015079]		sseqid: F4BYP3; pident: 100.0; length: 437; mismatch: 0; gapopen: 0; qstart: 1; qend: 437; sstart: 1; send: 437; evalue: 1.9999999999999987e-305; bitscore: 836.0; Entry: F4BYP3; Entry Name: F4BYP3_METSG; Annotation: 1.0; Pfam: PF02080;PF02254;
tr|F4BYP1|F4BYP1_METSG	UPIMAPI	Glycogen debranching enzyme, archaeal type, putative		4-alpha-glucanotransferase activity [GO:0004134]; amylo-alpha-1,6-glucosidase activity [GO:0004135]; glycogen catabolic process [GO:0005980]		sseqid: F4BYP1; pident: 100.0; length: 621; mismatch: 0; gapopen: 0; qstart: 1; qend: 621; sstart: 1; send: 621; evalue: 0.0; bitscore: 1279.0; Entry: F4BYP1; Entry Name: F4BYP1_METSG; Annotation: 1.0; Pfam: PF06202;PF12439;
tr|F4BYP0|F4BYP0_METSG	UPIMAPI	Glycosyltransferase family 57 protein		transferase activity [GO:0016740]; carbohydrate metabolic process [GO:0005975]		sseqid: F4BYP0; pident: 100.0; length: 492; mismatch: 0; gapopen: 0; qstart: 1; qend: 492; sstart: 1; send: 492; evalue: 0.0; bitscore: 1017.0; Entry: F4BYP0; Entry Name: F4BYP0_METSG; Annotation: 1.0; Protein families: Glycosyl hydrolase 57 family; Pfam: PF03065;
tr|F4BYK3|F4BYK3_METSG	UPIMAPI	Aminotransferase (EC 2.6.1.-)		L,L-diaminopimelate aminotransferase activity [GO:0010285]; pyridoxal phosphate binding [GO:0030170]; lysine biosynthetic process via diaminopimelate [GO:0009089]	2.6.1.-	sseqid: F4BYK3; pident: 100.0; length: 383; mismatch: 0; gapopen: 0; qstart: 1; qend: 383; sstart: 1; send: 383; evalue: 2.5599999999999982e-276; bitscore: 758.0; Entry: F4BYK3; Entry Name: F4BYK3_METSG; Annotation: 1.0; Protein families: Class-I pyridoxal-phosphate-dependent aminotransferase family; Pfam: PF00155;
tr|F4BYJ2|F4BYJ2_METSG	UPIMAPI	Lipoprotein				sseqid: F4BYJ2; pident: 100.0; length: 243; mismatch: 0; gapopen: 0; qstart: 1; qend: 243; sstart: 1; send: 243; evalue: 2.6899999999999994e-153; bitscore: 435.0; Entry: F4BYJ2; Entry Name: F4BYJ2_METSG; Annotation: 1.0
tr|F4BYI3|F4BYI3_METSG	UPIMAPI	5,10-methylenetetrahydromethanopterin reductase (EC 1.5.98.2) (Coenzyme F420-dependent N(5),N(10)-methylenetetrahydromethanopterin reductase) (Methylene-H(4)MPT reductase)	FUNCTION: Catalyzes the reversible reduction of methylene-H(4)MPT to methyl-H(4)MPT. {ECO:0000256|HAMAP-Rule:MF_01091}.	cytoplasm [GO:0005737]; coenzyme F420-dependent N5,N10-methenyltetrahydromethanopterin reductase activity [GO:0018537]; oxidoreductase activity, acting on paired donors, with incorporation or reduction of molecular oxygen [GO:0016705]; methanogenesis, from carbon dioxide [GO:0019386]; one-carbon metabolic process [GO:0006730]	1.5.98.2	sseqid: A0A843JXQ4; pident: 100.0; length: 321; mismatch: 0; gapopen: 0; qstart: 1; qend: 321; sstart: 1; send: 321; evalue: 3.2199999999999984e-225; bitscore: 624.0; Entry: A0A843JXQ4; Entry Name: A0A843JXQ4_9EURY; Annotation: 2.0; Protein families: Mer family; Pfam: PF00296;
tr|F4BYH7|F4BYH7_METSG	UPIMAPI	Putative ABC transporter periplasmic-binding protein		ATP-binding cassette (ABC) transporter complex [GO:0043190]; periplasmic space [GO:0042597]; peptide transmembrane transporter activity [GO:1904680]; peptide transport [GO:0015833]		sseqid: A0A1V4VEX0; pident: 100.0; length: 512; mismatch: 0; gapopen: 0; qstart: 1; qend: 512; sstart: 18; send: 529; evalue: 0.0; bitscore: 1028.0; Entry: A0A1V4VEX0; Entry Name: A0A1V4VEX0_9EURY; Annotation: 1.0; Pfam: PF00496;
tr|F4BYH6|F4BYH6_METSG	UPIMAPI	Cell division inhibitor MinD		cytoplasmic side of plasma membrane [GO:0009898]; cytosol [GO:0005829]; ATP binding [GO:0005524]; ATP hydrolysis activity [GO:0016887]; cell division [GO:0051301]; negative regulation of cell division [GO:0051782]		sseqid: A0A1V4VEL7; pident: 100.0; length: 249; mismatch: 0; gapopen: 0; qstart: 1; qend: 249; sstart: 1; send: 249; evalue: 1.5999999999999996e-173; bitscore: 487.0; Entry: A0A1V4VEL7; Entry Name: A0A1V4VEL7_9EURY; Annotation: 1.0; Pfam: PF01656;
tr|F4BYH4|F4BYH4_METSG	UPIMAPI	Formylmethanofuran dehydrogenase subunit E domain-containing protein				sseqid: A0A843JQW4; pident: 100.0; length: 345; mismatch: 0; gapopen: 0; qstart: 1; qend: 345; sstart: 1; send: 345; evalue: 1.0499999999999997e-258; bitscore: 710.0; Entry: A0A843JQW4; Entry Name: A0A843JQW4_9EURY; Annotation: 1.0; Pfam: PF02663;
tr|F4BYG4|F4BYG4_METSG	UPIMAPI	Thyroglobulin type-1 domain-containing protein				sseqid: A0A1V4V7D8; pident: 100.0; length: 379; mismatch: 0; gapopen: 0; qstart: 1; qend: 379; sstart: 1; send: 379; evalue: 2.02e-188; bitscore: 535.0; Entry: A0A1V4V7D8; Entry Name: A0A1V4V7D8_9EURY; Annotation: 1.0
tr|F4BYB6|F4BYB6_METSG	UPIMAPI	acylphosphatase (EC 3.6.1.7)		acylphosphatase activity [GO:0003998]	3.6.1.7	sseqid: F4BYB6; pident: 100.0; length: 199; mismatch: 0; gapopen: 0; qstart: 1; qend: 199; sstart: 1; send: 199; evalue: 1.6899999999999995e-100; bitscore: 298.0; Entry: F4BYB6; Entry Name: F4BYB6_METSG; Annotation: 2.0; Protein families: Acylphosphatase family; Pfam: PF00708;
tr|F4BYB3|F4BYB3_METSG	UPIMAPI	CDC48 family AAA ATPase		cytoplasm [GO:0005737]; intracellular membrane-bounded organelle [GO:0043231]; ATP binding [GO:0005524]; ATP hydrolysis activity [GO:0016887]		sseqid: A0A7K4AGG0; pident: 100.0; length: 758; mismatch: 0; gapopen: 0; qstart: 1; qend: 758; sstart: 1; send: 758; evalue: 0.0; bitscore: 1465.0; Entry: A0A7K4AGG0; Entry Name: A0A7K4AGG0_METSH; Annotation: 1.0; Protein families: AAA ATPase family, CDC48 subfamily; Pfam: PF00004;PF17862;PF02933;PF02359;
tr|F4BYA5|F4BYA5_METSG	UPIMAPI	ACT domain-containing protein				sseqid: A0A843K706; pident: 100.0; length: 144; mismatch: 0; gapopen: 0; qstart: 1; qend: 144; sstart: 1; send: 144; evalue: 9.18e-92; bitscore: 271.0; Entry: A0A843K706; Entry Name: A0A843K706_9EURY; Annotation: 1.0; Pfam: PF19571;
tr|F4BYA4|F4BYA4_METSG	UPIMAPI	Phenylacetate--CoA ligase		phenylacetate-CoA ligase activity [GO:0047475]; phenylacetate catabolic process [GO:0010124]		sseqid: A0A7K4AKJ2; pident: 100.0; length: 434; mismatch: 0; gapopen: 0; qstart: 1; qend: 434; sstart: 1; send: 434; evalue: 0.0; bitscore: 874.0; Entry: A0A7K4AKJ2; Entry Name: A0A7K4AKJ2_METSH; Annotation: 1.0; Pfam: PF00501;PF14535;
tr|F4BY92|F4BY92_METSG	UPIMAPI	4-hydroxy-tetrahydrodipicolinate synthase (HTPA synthase) (EC 4.3.3.7)	FUNCTION: Catalyzes the condensation of (S)-aspartate-beta-semialdehyde [(S)-ASA] and pyruvate to 4-hydroxy-tetrahydrodipicolinate (HTPA). {ECO:0000256|ARBA:ARBA00003294, ECO:0000256|HAMAP-Rule:MF_00418}.	cytoplasm [GO:0005737]; 2-dehydro-3-deoxy-phosphogluconate aldolase activity [GO:0008675]; 4-hydroxy-tetrahydrodipicolinate synthase activity [GO:0008840]; diaminopimelate biosynthetic process [GO:0019877]; lysine biosynthetic process via diaminopimelate [GO:0009089]	4.3.3.7	sseqid: A0A1V4VCG8; pident: 100.0; length: 291; mismatch: 0; gapopen: 0; qstart: 1; qend: 291; sstart: 1; send: 291; evalue: 7.169999999999998e-207; bitscore: 575.0; Entry: A0A1V4VCG8; Entry Name: A0A1V4VCG8_9EURY; Annotation: 3.0; Protein families: DapA family; Pfam: PF00701;
tr|F4BY91|F4BY91_METSG	UPIMAPI	4-hydroxy-tetrahydrodipicolinate reductase (HTPA reductase) (EC 1.17.1.8)	FUNCTION: Catalyzes the conversion of 4-hydroxy-tetrahydrodipicolinate (HTPA) to tetrahydrodipicolinate. {ECO:0000256|HAMAP-Rule:MF_00102}.	cytoplasm [GO:0005737]; 4-hydroxy-tetrahydrodipicolinate reductase [GO:0008839]; NAD binding [GO:0051287]; NADP binding [GO:0050661]; oxidoreductase activity, acting on CH or CH2 groups, NAD or NADP as acceptor [GO:0016726]; diaminopimelate biosynthetic process [GO:0019877]; lysine biosynthetic process via diaminopimelate [GO:0009089]	1.17.1.8	sseqid: F4BY91; pident: 100.0; length: 261; mismatch: 0; gapopen: 0; qstart: 1; qend: 261; sstart: 1; send: 261; evalue: 8.839999999999999e-177; bitscore: 496.0; Entry: F4BY91; Entry Name: F4BY91_METSG; Annotation: 3.0; Protein families: DapB family; Pfam: PF05173;PF01113;
tr|F4BY88|F4BY88_METSG	UPIMAPI	Threonine dehydratase				sseqid: A0A1V4UVC2; pident: 100.0; length: 168; mismatch: 0; gapopen: 0; qstart: 1; qend: 168; sstart: 1; send: 168; evalue: 1.9699999999999994e-109; bitscore: 318.0; Entry: A0A1V4UVC2; Entry Name: A0A1V4UVC2_9EURY; Annotation: 1.0
tr|F4BY87|F4BY87_METSG	UPIMAPI	Homoserine dehydrogenase (EC 1.1.1.3)		homoserine dehydrogenase activity [GO:0004412]; NADP binding [GO:0050661]; methionine biosynthetic process [GO:0009086]; threonine biosynthetic process [GO:0009088]	1.1.1.3	sseqid: A0A1V4UVG6; pident: 100.0; length: 335; mismatch: 0; gapopen: 0; qstart: 1; qend: 335; sstart: 1; send: 335; evalue: 3.779999999999997e-231; bitscore: 640.0; Entry: A0A1V4UVG6; Entry Name: A0A1V4UVG6_9EURY; Annotation: 2.0; Protein families: Homoserine dehydrogenase family; Pfam: PF00742;PF03447;
tr|F4BY85|F4BY85_METSG	UPIMAPI	Histidinol dehydrogenase (HDH) (EC 1.1.1.23)	FUNCTION: Catalyzes the sequential NAD-dependent oxidations of L-histidinol to L-histidinaldehyde and then to L-histidine. {ECO:0000256|HAMAP-Rule:MF_01024, ECO:0000256|PIRNR:PIRNR000099}.	cytoplasm [GO:0005737]; histidinol dehydrogenase activity [GO:0004399]; NAD binding [GO:0051287]; zinc ion binding [GO:0008270]; L-histidine biosynthetic process [GO:0000105]	1.1.1.23	sseqid: F4BY85; pident: 100.0; length: 428; mismatch: 0; gapopen: 0; qstart: 1; qend: 428; sstart: 1; send: 428; evalue: 1.6099999999999995e-295; bitscore: 810.0; Entry: F4BY85; Entry Name: F4BY85_METSG; Annotation: 3.0; Protein families: Histidinol dehydrogenase family; Pfam: PF00815;
tr|F4BY73|F4BY73_METSG	UPIMAPI	Phosphoglycerate kinase (EC 2.7.2.3)		cytosol [GO:0005829]; ADP binding [GO:0043531]; ATP binding [GO:0005524]; phosphoglycerate kinase activity [GO:0004618]; gluconeogenesis [GO:0006094]; glycolytic process [GO:0006096]	2.7.2.3	sseqid: A0A7K4AJA4; pident: 100.0; length: 400; mismatch: 0; gapopen: 0; qstart: 1; qend: 400; sstart: 1; send: 400; evalue: 3.149999999999998e-281; bitscore: 772.0; Entry: A0A7K4AJA4; Entry Name: A0A7K4AJA4_METSH; Annotation: 3.0; Protein families: Phosphoglycerate kinase family; Pfam: PF00162;
tr|F4BY71|F4BY71_METSG	UPIMAPI	WD40-like Beta Propeller Repeat protein				sseqid: F4BY71; pident: 100.0; length: 1137; mismatch: 0; gapopen: 0; qstart: 1; qend: 1137; sstart: 1; send: 1137; evalue: 0.0; bitscore: 1046.0; Entry: F4BY71; Entry Name: F4BY71_METSG; Annotation: 1.0; Protein families: TolB family; Pfam: PF07676;
tr|F4BY70|F4BY70_METSG	UPIMAPI	Pyridoxal 5'-phosphate synthase subunit PdxS (PLP synthase subunit PdxS) (EC 4.3.3.6) (Pdx1)	FUNCTION: Catalyzes the formation of pyridoxal 5'-phosphate from ribose 5-phosphate (RBP), glyceraldehyde 3-phosphate (G3P) and ammonia. The ammonia is provided by the PdxT subunit. Can also use ribulose 5-phosphate and dihydroxyacetone phosphate as substrates, resulting from enzyme-catalyzed isomerization of RBP and G3P, respectively. {ECO:0000256|HAMAP-Rule:MF_01824}.	pyridoxal 5'-phosphate synthase (glutamine hydrolysing) activity [GO:0036381]; amino acid metabolic process [GO:0006520]; pyridoxal phosphate biosynthetic process [GO:0042823]; pyridoxine biosynthetic process [GO:0008615]	4.3.3.6	sseqid: A0A7K4AJL9; pident: 100.0; length: 297; mismatch: 0; gapopen: 0; qstart: 1; qend: 297; sstart: 1; send: 297; evalue: 3.509999999999999e-201; bitscore: 561.0; Entry: A0A7K4AJL9; Entry Name: A0A7K4AJL9_METSH; Annotation: 3.0; Protein families: PdxS/SNZ family; Pfam: PF01680;
tr|F4BY67|F4BY67_METSG	UPIMAPI	Uncharacterized protein				sseqid: F4BY67; pident: 100.0; length: 1143; mismatch: 0; gapopen: 0; qstart: 1; qend: 1143; sstart: 1; send: 1143; evalue: 0.0; bitscore: 2129.0; Entry: F4BY67; Entry Name: F4BY67_METSG; Annotation: 1.0
tr|F4BY65|F4BY65_METSG	UPIMAPI	Lipoprotein				sseqid: F4BY65; pident: 100.0; length: 199; mismatch: 0; gapopen: 0; qstart: 1; qend: 199; sstart: 1; send: 199; evalue: 2.1399999999999992e-135; bitscore: 386.0; Entry: F4BY65; Entry Name: F4BY65_METSG; Annotation: 1.0
tr|F4BY48|F4BY48_METSG	UPIMAPI	Phosphate ABC transporter periplasmic substrate-binding protein PstS		phosphate ion binding [GO:0042301]		sseqid: A0A1V4V4D5; pident: 100.0; length: 274; mismatch: 0; gapopen: 0; qstart: 1; qend: 274; sstart: 1; send: 274; evalue: 2.98e-186; bitscore: 521.0; Entry: A0A1V4V4D5; Entry Name: A0A1V4V4D5_9EURY; Annotation: 1.0; Pfam: PF12849;
tr|F4BY47|F4BY47_METSG	UPIMAPI	Flavodoxin domain-containing protein		electron transfer activity [GO:0009055]; FMN binding [GO:0010181]		sseqid: A0A843K5F9; pident: 100.0; length: 144; mismatch: 0; gapopen: 0; qstart: 1; qend: 144; sstart: 1; send: 144; evalue: 6.999999999999999e-96; bitscore: 282.0; Entry: A0A843K5F9; Entry Name: A0A843K5F9_9EURY; Annotation: 1.0; Pfam: PF00258;
tr|F4BY44|F4BY44_METSG	UPIMAPI	Coenzyme F420 hydrogenase subunit beta (EC 1.12.98.1)		coenzyme F420 hydrogenase activity [GO:0050454]; oxidoreductase activity, acting on CH or CH2 groups, with an iron-sulfur protein as acceptor [GO:0052592]	1.12.98.1	sseqid: F4BY44; pident: 100.0; length: 288; mismatch: 0; gapopen: 0; qstart: 1; qend: 288; sstart: 1; send: 288; evalue: 3.379999999999999e-199; bitscore: 555.0; Entry: F4BY44; Entry Name: F4BY44_METSG; Annotation: 1.0; Pfam: PF04432;PF04422;
tr|F4BY33|F4BY33_METSG	UPIMAPI	Aminotransferase (EC 2.6.1.-)		pyridoxal phosphate binding [GO:0030170]; transaminase activity [GO:0008483]; amino acid metabolic process [GO:0006520]; biosynthetic process [GO:0009058]	2.6.1.-	sseqid: F4BY33; pident: 100.0; length: 378; mismatch: 0; gapopen: 0; qstart: 1; qend: 378; sstart: 1; send: 378; evalue: 3.209999999999998e-272; bitscore: 747.0; Entry: F4BY33; Entry Name: F4BY33_METSG; Annotation: 2.0; Protein families: Class-I pyridoxal-phosphate-dependent aminotransferase family; Pfam: PF00155;
tr|F4BY31|F4BY31_METSG	UPIMAPI	Branched-chain-amino-acid aminotransferase (BCAT) (EC 2.6.1.42)	FUNCTION: Acts on leucine, isoleucine and valine. {ECO:0000256|ARBA:ARBA00003109, ECO:0000256|RuleBase:RU364094}.	L-isoleucine-2-oxoglutarate transaminase activity [GO:0052656]; L-leucine-2-oxoglutarate transaminase activity [GO:0052654]; L-valine-2-oxoglutarate transaminase activity [GO:0052655]; isoleucine biosynthetic process [GO:0009097]; L-leucine biosynthetic process [GO:0009098]; L-valine biosynthetic process [GO:0009099]	2.6.1.42	sseqid: F4BY31; pident: 100.0; length: 288; mismatch: 0; gapopen: 0; qstart: 1; qend: 288; sstart: 1; send: 288; evalue: 4.4799999999999984e-204; bitscore: 567.0; Entry: F4BY31; Entry Name: F4BY31_METSG; Annotation: 3.0; Protein families: Class-IV pyridoxal-phosphate-dependent aminotransferase family; Pfam: PF01063;
tr|F4BXZ6|F4BXZ6_METSG	UPIMAPI	S-layer-related duplication domain protein		membrane [GO:0016020]		sseqid: F4BXZ6; pident: 100.0; length: 1127; mismatch: 0; gapopen: 0; qstart: 1; qend: 1127; sstart: 1; send: 1127; evalue: 0.0; bitscore: 1843.0; Entry: F4BXZ6; Entry Name: F4BXZ6_METSG; Annotation: 1.0; Pfam: PF08308;PF07752;
tr|F4BXZ4|F4BXZ4_METSG	UPIMAPI	3-methyl-2-oxobutanoate dehydrogenase subunit VorB		oxidoreductase activity [GO:0016491]; organic acid metabolic process [GO:0006082]; sulfur compound biosynthetic process [GO:0044272]		sseqid: A0A7K4AJW7; pident: 100.0; length: 347; mismatch: 0; gapopen: 0; qstart: 1; qend: 347; sstart: 1; send: 347; evalue: 7.289999999999998e-251; bitscore: 691.0; Entry: A0A7K4AJW7; Entry Name: A0A7K4AJW7_METSH; Annotation: 1.0; Pfam: PF17147;PF01855;
tr|F4BXY9|F4BXY9_METSG	UPIMAPI	Aminotransferase (EC 2.6.1.-)		pyridoxal phosphate binding [GO:0030170]; transaminase activity [GO:0008483]; amino acid metabolic process [GO:0006520]; biosynthetic process [GO:0009058]	2.6.1.-	sseqid: A0A7K4AJX3; pident: 100.0; length: 402; mismatch: 0; gapopen: 0; qstart: 1; qend: 402; sstart: 1; send: 402; evalue: 4.749999999999997e-293; bitscore: 802.0; Entry: A0A7K4AJX3; Entry Name: A0A7K4AJX3_METSH; Annotation: 2.0; Protein families: Class-I pyridoxal-phosphate-dependent aminotransferase family; Pfam: PF00155;
tr|F4BXY4|F4BXY4_METSG	UPIMAPI	Methyl-coenzyme M reductase subunit beta (EC 2.8.4.1) (Coenzyme-B sulfoethylthiotransferase beta)		coenzyme-B sulfoethylthiotransferase activity [GO:0050524]; methanogenesis [GO:0015948]	2.8.4.1	sseqid: A0A1V4V8N4; pident: 100.0; length: 434; mismatch: 0; gapopen: 0; qstart: 1; qend: 434; sstart: 1; send: 434; evalue: 6.169999999999996e-303; bitscore: 830.0; Entry: A0A1V4V8N4; Entry Name: A0A1V4V8N4_9EURY; Annotation: 2.0; Protein families: Methyl-coenzyme M reductase beta subunit family; Pfam: PF02241;PF02783;
tr|F4BXY3|F4BXY3_METSG	UPIMAPI	Methyl-coenzyme M reductase II operon protein D		methanogenesis [GO:0015948]		sseqid: A0A1V4V7K9; pident: 100.0; length: 167; mismatch: 0; gapopen: 0; qstart: 1; qend: 167; sstart: 1; send: 167; evalue: 9.829999999999996e-114; bitscore: 329.0; Entry: A0A1V4V7K9; Entry Name: A0A1V4V7K9_9EURY; Annotation: 1.0; Pfam: PF02505;
tr|F4BXY2|F4BXY2_METSG	UPIMAPI	coenzyme-B sulfoethylthiotransferase (EC 2.8.4.1)		coenzyme-B sulfoethylthiotransferase activity [GO:0050524]; methanogenesis [GO:0015948]	2.8.4.1	sseqid: A0A1V4V7K5; pident: 100.0; length: 255; mismatch: 0; gapopen: 0; qstart: 1; qend: 255; sstart: 1; send: 255; evalue: 1.6199999999999993e-194; bitscore: 540.0; Entry: A0A1V4V7K5; Entry Name: A0A1V4V7K5_9EURY; Annotation: 2.0; Protein families: Methyl-coenzyme M reductase gamma subunit family; Pfam: PF02240;
